,BlockName,Category,CreatedOn,Crop,DistrictName,KCCAns,QueryText,QueryType,Season,Sector,StateName
277,TIRTOL                                            ,Others,2017-07-24 14:32:45.253,Others,JAGATSINGHAPUR,"50% subsidy on Rotavator, apply to AAO or DAO of your block",Rotavator subsidy,Agriculture Mechanization,KHARIF,AGRICULTURE,ODISHA
278,TIRTOL                                            ,Cereals,2017-07-25 17:13:47.470,Paddy (Dhan),JAGATSINGHAPUR,RECOMMENDED TO SPRAY PENDEIMETHALINE 1330ML/ 20 KG SAND ACRE FOR CONTROL OF WEED MANAGEMENT OF PADDY,WEED MANAGEMENT OF PADDY,Weed Management,KHARIF,AGRICULTURE,ODISHA
279,RAGHUNATHPUR                                      ,Cereals,2017-07-26 16:40:15.100,Paddy (Dhan),JAGATSINGHAPUR,PMFBY Kharif Paddy 2017 : Premium payable Rs. 950 sum assured Rs. 47500 per hectare latest by 31 July 2017 in any Nationalised or Co-operative bank,Crop insurance for Kharif Paddy 2017,Crop Insurance,KHARIF,AGRICULTURE,ODISHA
280,JAGATSINGHPUR                                     ,Fruits,2017-07-31 14:40:57.880,Mango,JAGATSINGHAPUR,SPACING OF MANGO --- 10 MET PLANT TO PLANT AND ROW TO ROW -10 MET,SPACING OF MANGO,Cultural Practices,KHARIF,HORTICULTURE,ODISHA
281,BALIKUDA                                          ,Vegetables,2017-07-31 19:03:33.370,Bhindi(Okra/Ladysfinger),JAGATSINGHAPUR,RECOMMENDED TO SPRAY TATAMIDA 1ML/ 3 LIT WATER FOR CONTROL OF SUCKING PEST IN BHINDI,SUCKING PEST IN BHINDI,	Plant Protection	,KHARIF,HORTICULTURE,ODISHA
282,BALIKUDA                                          ,Vegetables,2017-07-31 19:05:35.923,Brinjal,JAGATSINGHAPUR,RECOMMENDED TO SPRAY SPINOSAD 1ML/3 LIT WATER FOR CONTROL OF FRUIT BORER IN BRINJAL,FRUIT BORER IN BRINJAL,	Plant Protection	,KHARIF,HORTICULTURE,ODISHA
283,TIRTOL                                            ,Vegetables,2017-08-01 17:26:09.867,Chillies,JAGATSINGHAPUR,RECOMMENDED TO SPRAY COPPER OXICHLORIDE 30 GM + STREPTOCYCLIN  1.5 GM/ LIT WATER FOR CONTROL OF WILTING DISEASES IN CHILLIES,WILTING DISEASES IN CHILLIES,	Plant Protection	,KHARIF,HORTICULTURE,ODISHA
284,TIRTOL                                            ,Animal,2017-08-04 19:36:21.470,"Bovine(Cow,Buffalo)",JAGATSINGHAPUR,"CONTACT VETANAIRY OFFICER, JAGATSINGPUR DIST FOR DISEASES MANAGEMENT OF COW",DISEASES MANAGEMENT OF COW,Disease Management,KHARIF,ANIMAL HUSBANDRY,ODISHA
285,RAGHUNATHPUR                                      ,Cereals,2017-08-04 20:21:07.203,Paddy (Dhan),JAGATSINGHAPUR,Recommended to apply 4kg Urea + 35kg DAP + 18kg MoP per acre as basal dose of fertilizer for Paddy,Basal dose of fertilizer for Paddy,Fertilizer Use and Availability,KHARIF,AGRICULTURE,ODISHA
286,JAGATSINGHPUR                                     ,Others,2017-08-05 07:26:49.187,Others,JAGATSINGHAPUR,EXPECTED RAINFALL 9 MM OCCURS ON 8TH AUGUST 2017 IN JAGATSINGHPUR DIST,RAINFALL FORECAST IN JAGATSINGHPUR DIST,Weather,KHARIF,AGRICULTURE,ODISHA
287,TIRTOL                                            ,Cereals,2017-08-08 14:24:59.257,Paddy (Dhan),JAGATSINGHAPUR,DETAIL DATA EXPLAINED IN SRI METHOD PADDY CULTIVATION,SRI METHOD PADDY CULTIVATION,Cultural Practices,KHARIF,AGRICULTURE,ODISHA
288,TIRTOL                                            ,Cereals,2017-08-08 14:26:22.790,Paddy (Dhan),JAGATSINGHAPUR,Recommended to apply Fipronil 80% WG 20-25kg per acre at the time of puddling as a precautionary measure against Paddy stem borer,Usage and dosage of Regent,	Plant Protection	,KHARIF,AGRICULTURE,ODISHA
289,ERASAMA                                           ,Animal,2017-08-08 16:38:26.367,"Bovine(Cow,Buffalo)",JAGATSINGHAPUR,"CONTACT VETERINARY OFFICER, JAGATSINGPUR DIST FOR DAIRY PRODUCTION",DAIRY PRODUCATION,Dairy Production,KHARIF,ANIMAL HUSBANDRY,ODISHA
290,KUJANG                                            ,Vegetables,2017-08-08 19:40:58.603,Cowpea (Vegetable),JAGATSINGHAPUR,RECOMMENDED TO SPRAY VIPUAL BOOSTER 2ML/ LIT WATER FOR BETTER GROWTH AND YIELD IN COWPEA,FOR BETTER GROWTH AND YIELD IN COWPEA,Cultural Practices,KHARIF,HORTICULTURE,ODISHA
291,KUJANG                                            ,Vegetables,2017-08-08 19:44:57.427,Brinjal,JAGATSINGHAPUR,RECOMMENDED  TO SPRAY TATAMIDA 1ML/3 LIT WATER FOR CONTROL OF SUCKING PEST IN BRINJAL,SUCKING PEST IN BRINJAL,	Plant Protection	,KHARIF,HORTICULTURE,ODISHA
292,ERASAMA                                           ,Medicinal and Aromatic Plants,2017-08-09 19:35:09.080,Betel Vine,JAGATSINGHAPUR,RECOMMENDED TO SPRAY SAAF 2 GM + PLANTOMYCIN 1 GM + 1 LIT WATER,COLLAR ROT IN BETEL VINE,	Plant Protection	,KHARIF,HORTICULTURE,ODISHA
293,TIRTOL                                            ,Cereals,2017-08-09 19:57:09.890,Paddy (Dhan),JAGATSINGHAPUR,"APPLY 2,4-D SODIUM SALT @ 500 GRAM / ACRE",ALGAL BLOOM IN PADDY,Weather,KHARIF,AGRICULTURE,ODISHA
294,TIRTOL                                            ,Cereals,2017-08-10 15:57:06.973,Paddy (Dhan),JAGATSINGHAPUR,APPLY DAP @ 35 KG + MOP @ 27 KG + UREA @ 4 KG / ACRE,NUTRIENT MANAGEMENT IN PADDY,Nutrient Management,KHARIF,AGRICULTURE,ODISHA
295,BALIKUDA                                          ,Cereals,2017-08-10 18:30:56.693,Paddy (Dhan),JAGATSINGHAPUR,APPLY UREA @ 35 KG + MOP @ 27 KG / ACRE,NUTRIENT MANAGEMENT IN PADDY,Nutrient Management,KHARIF,AGRICULTURE,ODISHA
296,ERASAMA                                           ,Cereals,2017-08-11 19:52:34.163,Paddy (Dhan),JAGATSINGHAPUR,RECOMMENDED TO SPRAY NOMINEEGOLD 80 ML/20 KG SAND ACRE FOR CONTROL OF WEED MANAGEMENT OF PADDY,WEED MANAGEMENT OF PADDY,Weed Management,KHARIF,AGRICULTURE,ODISHA
297,NAUGAON                                           ,Cereals,2017-08-12 14:02:18.407,Paddy (Dhan),JAGATSINGHAPUR,"Recommended to apply 2,4-D 5odium salt 500gm per acre to control Algal bloom in Paddy in Paddy",Algal bloom in Paddy in Paddy,Weed Management,KHARIF,AGRICULTURE,ODISHA
298,ERASAMA                                           ,Vegetables,2017-08-13 08:04:39.380,Brinjal,JAGATSINGHAPUR,RECOMMENDED TO SPRAY FAME 5 ML/15 LIT WATER FOR CONTROL OF STEM BORER IN BRINJAL,STEM BORER IN BRINJAL,	Plant Protection	,KHARIF,HORTICULTURE,ODISHA
299,ERASAMA                                           ,Vegetables,2017-08-13 08:04:39.380,Brinjal,JAGATSINGHAPUR,RECOMMENDED TO SPRAY FAME 5 ML/15 LIT WATER FOR CONTROL OF STEM BORER IN BRINJAL,STEM BORER IN BRINJAL,	Plant Protection	,KHARIF,HORTICULTURE,ODISHA
300,NAUGAON                                           ,Cereals,2017-08-13 18:08:20.077,Paddy (Dhan),JAGATSINGHAPUR,RECOMMENDED TO SPRAY NOMINEE GOLD @ 80 ML / ACRE,WEED MANAGEMENT IN PADDY,Weed Management,KHARIF,AGRICULTURE,ODISHA
301,NAUGAON                                           ,Cereals,2017-08-13 18:08:20.077,Paddy (Dhan),JAGATSINGHAPUR,RECOMMENDED TO SPRAY NOMINEE GOLD @ 80 ML / ACRE,WEED MANAGEMENT IN PADDY,Weed Management,KHARIF,AGRICULTURE,ODISHA
302,JAGATSINGHPUR                                     ,Animal,2017-08-13 18:43:25.783,"Bovine(Cow,Buffalo)",JAGATSINGHAPUR,CONTACT WITH BLOCK VETERINARY OFFICER,VETERINARY QUERY,Disease Reporting,KHARIF,ANIMAL HUSBANDRY,ODISHA
303,JAGATSINGHPUR                                     ,Animal,2017-08-13 18:43:25.783,"Bovine(Cow,Buffalo)",JAGATSINGHAPUR,CONTACT WITH BLOCK VETERINARY OFFICER,VETERINARY QUERY,Disease Reporting,KHARIF,ANIMAL HUSBANDRY,ODISHA
304,BALIKUDA                                          ,Flowers,2017-08-18 16:20:18.990,Marigold,JAGATSINGHAPUR,RECOMMENDED TO SPRAY TATAMIDA 1 ML/3 LIT WATER FOR CONTROL OF SUCKING PEST IN MARI GOLD,SUCKING PEST IN MARI GOLD,	Plant Protection	,KHARIF,HORTICULTURE,ODISHA
305,ERASAMA                                           ,Vegetables,2017-08-18 20:38:31.593,Cauliflower,JAGATSINGHAPUR,"VARIETY OF CAULIFLOWER--0-KARTIKA,PUSA DIPALI,GOODMAN",VARIETY OF CAULIFLOWER,Cultural Practices,KHARIF,HORTICULTURE,ODISHA
306,ERASAMA                                           ,Medicinal and Aromatic Plants,2017-08-19 10:43:03.157,Betel Vine,JAGATSINGHAPUR,RECOMMENDED TO SPRAY ROGOR 2ML/ LIT WATER FOR CONTROL OF APHID PEST IN BETEL VINE,APHID PEST IN BETEL VINE,	Plant Protection	,KHARIF,HORTICULTURE,ODISHA
307,TIRTOL                                            ,Vegetables,2017-08-19 14:28:46.853,Bitter Gourd,JAGATSINGHAPUR,RECOMMENDED TO SPRAY CHLORPYRIFOS 2.5 ML/ 1 LIT WATER,LEAF EATING CATERPILLAR IN BITTER GOURD,	Plant Protection	,KHARIF,HORTICULTURE,ODISHA
308,RAGHUNATHPUR                                      ,Vegetables,2017-08-20 14:58:48.623,Brinjal,JAGATSINGHAPUR,RECOMMENDED TO SPRAY IMIDACLOPRID 1 ML/3 LIT WATER,LEAF CURLING IN BRINJAL,	Plant Protection	,KHARIF,HORTICULTURE,ODISHA
309,ERASAMA                                           ,Others,2017-08-20 19:53:48.847,Others,JAGATSINGHAPUR,EXPECTED RAINFALL 7 MM OCCURS ON 23RD 2017 IN JAGATSINGHPUR DIST,RAINFALL FORECAST IN JAGATSINGHPUR DIST,Weather,KHARIF,AGRICULTURE,ODISHA
310,NAUGAON                                           ,Fruits,2017-08-21 14:39:29.803,Papaya,JAGATSINGHAPUR,RECOMMENDED TO SPRAY NPK MIXTURE 100 GM/TREE GIVEN FOR BETTER GROWTH AND YIELD IN PAPAYA,FOR BETTER GROWTH AND YIELD IN PAPAYA,Cultural Practices,KHARIF,HORTICULTURE,ODISHA
311,TIRTOL                                            ,Cereals,2017-08-21 15:44:35.127,Paddy (Dhan),JAGATSINGHAPUR,DETAIL PACKAGE OF PRACTICE EXPLAINED IN SRI METHOD PADDY CULTIVATION,SRI METHOD PADDY CULTIVATION,Cultural Practices,KHARIF,AGRICULTURE,ODISHA
312,RAGHUNATHPUR                                      ,Cereals,2017-08-21 18:19:50.957,Paddy (Dhan),JAGATSINGHAPUR,DETAIL PACKAGE OF PRACTICE EXPLAINED IN SRI METHOD PADDY CULTIVATION,SRI METHOD PADDY CULTIVATION,Weed Management,KHARIF,AGRICULTURE,ODISHA
313,RAGHUNATHPUR                                      ,Cereals,2017-08-24 08:57:08.353,Paddy (Dhan),JAGATSINGHAPUR,Recommended to spray Validamycin(Sheathmar)/Hexaconazol(Contaf Plus) 2ml per litre of water to control sheath rot in Paddy,Sheath rot in Paddy,	Plant Protection	,KHARIF,AGRICULTURE,ODISHA
314,RAGHUNATHPUR                                      ,Vegetables,2017-08-24 18:33:45.230,Pointed Gourd,JAGATSINGHAPUR,RECOMMENDED TO SPRAY FANTAC PLUS 7ML/15 LIT WATER AT AFTERNOON,FLOWERING HORMONE IN POINTED GOURD,Cultural Practices,KHARIF,HORTICULTURE,ODISHA
315,BALIKUDA                                          ,Cereals,2017-08-24 19:10:09.503,Paddy (Dhan),JAGATSINGHAPUR,"APPLY 2, 4 D AMINE SALT @ 50 ML / 15 LIT OF WATER",WEED MANAGEMENT IN PADDY,Weed Management,KHARIF,AGRICULTURE,ODISHA
316,ERASAMA                                           ,Cereals,2017-08-25 18:54:24.930,Paddy (Dhan),JAGATSINGHAPUR,RECOMMENDED TO SPRAY NOMINEEGOLD 80 ML/200 LIT WATER ACRE FOR CONTROL OF WEED MANAGEMENT OF PADDY,WEED MANAGEMENT OF PADDY,Weed Management,KHARIF,AGRICULTURE,ODISHA
317,KUJANG                                            ,Cereals,2017-08-25 19:31:27.553,Paddy (Dhan),JAGATSINGHAPUR,"FERTILIZER DOSE OF PADDY -- NITROGEN-20 KG, POTASH-20 KG, PHOSPHORUS-15 KG/ACRE",FERTILIZER DOSE OF PADDY,Cultural Practices,KHARIF,AGRICULTURE,ODISHA
318,TIRTOL                                            ,Cereals,2017-08-26 08:19:14.290,Paddy (Dhan),JAGATSINGHAPUR,RECOMMENDED TO SPRAY CHLOROPYRIPHOUS 2ML/ LIT WATER FOR CONTROL OF CASE WORM IN PADDY,CASE WORM IN PADDY,	Plant Protection	,KHARIF,AGRICULTURE,ODISHA
319,JAGATSINGHPUR                                     ,Cereals,2017-08-26 16:35:09.660,Paddy (Dhan),JAGATSINGHAPUR,APPLY UREA @ 35 KG / ACRE,NUTRIENT MANAGEMENT IN PADDY,Nutrient Management,KHARIF,AGRICULTURE,ODISHA
320,JAGATSINGHPUR                                     ,Vegetables,2017-08-27 10:17:24.360,Cucumber,JAGATSINGHAPUR,RECOMMENDED TO SPRAY TATAMIDA 1ML/ 3 LIT WATER FOR CONTROL OF SUCKING PEST IN CUCUMBER,SUCKING PEST IN CUCUMBER,	Plant Protection	,KHARIF,HORTICULTURE,ODISHA
321,RAGHUNATHPUR                                      ,Vegetables,2017-08-30 15:56:29.287,Brinjal,JAGATSINGHAPUR,RECOMMENDED TO SPRAY RIDOMIL GOLD @ 2.5 GRAM / 1 LIT OF WATER,PHOMOPSIS BLIGHT IN BRINJAL,	Plant Protection	,KHARIF,HORTICULTURE,ODISHA
322,RAGHUNATHPUR                                      ,Vegetables,2017-08-30 17:18:05.257,Brinjal,JAGATSINGHAPUR,RECOMMENDED TO SPRAY RIDOMIL GOLD @ 2.5 GRAM / 1 LIT OF WATER,PHOMOPSIS BLIGHT IN BRINJAL,	Plant Protection	,KHARIF,HORTICULTURE,ODISHA
323,KUJANG                                            ,Plantation Crops,2017-09-02 17:36:52.547,Coconut,JAGATSINGHAPUR,"Fertiliser Dose for Coconut-Apply 800gm Urea,800gm SSP,1kg Potash per plant per year,half before & half after rainy season with 1-kg Steramil. Make a ring 3-ft from trunk,6-inch wide & depth,put compost with 20gm Chloropyriphos/Furadon",Coconut fertiliser management,Nutrient Management,KHARIF,HORTICULTURE,ODISHA
324,NAUGAON                                           ,Cereals,2017-09-04 19:52:56.280,Paddy (Dhan),JAGATSINGHAPUR,RECOMMENDED TO SPRAY HEXACONOZOL 2ML/LIT WATER FOR CONTROL OF STEM ROT IN PADDY,STEM ROT IN PADDY,	Plant Protection	,KHARIF,AGRICULTURE,ODISHA
325,JAGATSINGHPUR                                     ,Cereals,2017-09-07 18:11:39.730,Paddy (Dhan),JAGATSINGHAPUR,Recommended to spray Chlorpyriphos 20% EC 2.5ml per litre of water to control Grass hopper and White fly in Paddy,Grass hopper and White fly in Paddy,	Plant Protection	,KHARIF,AGRICULTURE,ODISHA
326,TIRTOL                                            ,Cereals,2017-09-09 09:15:14.030,Paddy (Dhan),JAGATSINGHAPUR,RECOMMENDED TO SPRAY COPPER OXICHLORIDE 2 GM + PLANTOMYCIN 1 GM/ LIT WATER FOR CONTROL OF BACTERIAL LEAF BLIGHT IN PADDY,BACTERIAL LEAF BLIGHT IN PADDY,	Plant Protection	,KHARIF,AGRICULTURE,ODISHA
327,BALIKUDA                                          ,Cereals,2017-09-09 09:56:45.263,Paddy (Dhan),JAGATSINGHAPUR,RECOMMENDED TO SPRAY QUAINALPHUS 2ML/ LIT WATER FOR CONTROL OF STEM BORER IN PADDY,STEM BORER IN PADDY,	Plant Protection	,KHARIF,AGRICULTURE,ODISHA
328,NAUGAON                                           ,Cereals,2017-09-09 12:39:42.843,Paddy (Dhan),JAGATSINGHAPUR,RECOMMENDED TO SPRAY COPPER OXICHLORIDE 2GM + PLANTOMYCIN 1GM/ LIT WATER FOR CONTROL OF BACTERIAL LEAF BLIGHT IN PADDY,BACTERIAL LEAF BLIGHT IN PADDY,	Plant Protection	,KHARIF,AGRICULTURE,ODISHA
329,JAGATSINGHPUR                                     ,Cereals,2017-09-09 20:53:00.923,Paddy (Dhan),JAGATSINGHAPUR,Recommended to spray Chlorpyriphos 20% EC 2.5ml per litre of water to control Paddy stem borer,Paddy stem borer,	Plant Protection	,KHARIF,AGRICULTURE,ODISHA
330,NAUGAON                                           ,Cereals,2017-09-10 09:33:20.363,Paddy (Dhan),JAGATSINGHAPUR,RECOMMENDED TO SPRAY CHLOROPYRIPHUS 2 ML/ LIT WATER FOR CONTROL OF CASE WORM IN PADDY,CASE WORM IN PADDY,	Plant Protection	,KHARIF,AGRICULTURE,ODISHA
331,NAUGAON                                           ,Cereals,2017-09-10 09:35:11.557,Paddy (Dhan),JAGATSINGHAPUR,Recommended to spray Triazophos 40% EC 2.5ml per litre of water to control Rice Hispa,Rice Hispa,	Plant Protection	,KHARIF,AGRICULTURE,ODISHA
332,ERASAMA                                           ,Vegetables,2017-09-10 12:00:39.677,Brinjal,JAGATSINGHAPUR,RECOMMENDED TO SPRAY ACEPHETE 2 GM/ LIT WATER FOR CONTROL OF LEAF CURL  IN  BRINJAL,LEAF CURL  IN  BRINJAL,	Plant Protection	,KHARIF,HORTICULTURE,ODISHA
333,JAGATSINGHPUR                                     ,Cereals,2017-09-11 20:10:26.900,Paddy (Dhan),JAGATSINGHAPUR,RECOMMENDED TO SPRAY BUFRAFEZIN 2ML/ LIT WATER FOR CONTROL OF BPH IN PADDY,BPH IN PADDY,	Plant Protection	,KHARIF,AGRICULTURE,ODISHA
334,NAUGAON                                           ,Vegetables,2017-09-11 21:20:16.393,Mushroom,JAGATSINGHAPUR,CONTACT HORTICULTURE DEPARTMENT FOR MUSHROOM CULTIVATION TRAINING,MUSHROOM CULTIVATION TRAINING,Cultural Practices,KHARIF,HORTICULTURE,ODISHA
335,TIRTOL                                            ,Vegetables,2017-09-12 18:48:49.947,Chillies,JAGATSINGHAPUR,RECOMMENDED TO SPRAY MULTI-K 7.5 GM/ LIT WATER FOR BETTER GROWTH AND YIELD IN CHILLIES,FOR BETTER GROWTH AND YIELD IN CHILLIES,Cultural Practices,KHARIF,HORTICULTURE,ODISHA
336,TIRTOL                                            ,Vegetables,2017-09-14 15:47:50.750,Brinjal,JAGATSINGHAPUR,RECOMMENDED TO SPRAY COPPER OXYCHLORIDE 2.5 GM + PLANTOMYCIN 1GM + 1 LIT WATER,WILT IN BRINJAL,	Plant Protection	,KHARIF,HORTICULTURE,ODISHA
337,TIRTOL                                            ,Cereals,2017-09-14 16:02:55.293,Paddy (Dhan),JAGATSINGHAPUR,RECOMMENDED TO SPRAY COPPER OXICHLORIDE 2 GM +PLANTOMYCIN 1 GM/ LIT WATER FOR CONTROL OF BACTERIAL LEAF BLIGHT IN PADDY,BACTERIAL LEAF BLIGHT IN PADDY,	Plant Protection	,KHARIF,AGRICULTURE,ODISHA
338,JAGATSINGHPUR                                     ,Vegetables,2017-09-14 19:41:01.923,Beans ,JAGATSINGHAPUR,RECOMMENDED TO SPRAY SAAF 2 GM/ LIT WATER FOR CONTROL OF ROOT ROT DISEASES IN BEANS,ROOT ROT DISEASES IN BEANS,	Plant Protection	,KHARIF,HORTICULTURE,ODISHA
339,TIRTOL                                            ,Cereals,2017-09-16 20:35:03.010,Paddy (Dhan),JAGATSINGHAPUR,"RECOMMENDED TO APPLY 2,4 D SODIUM SALT @ 500 GRAM",WEED MANAGEMENT IN PADDY,Weed Management,KHARIF,AGRICULTURE,ODISHA
340,KUJANG                                            ,Cereals,2017-09-18 19:57:54.603,Paddy (Dhan),JAGATSINGHAPUR,RECOMMENDED TO SPRAY QUINALPHOS @ 2.5 ML / 1 LIT OF WATER,CASE WORM IN PADDY,	Plant Protection	,KHARIF,AGRICULTURE,ODISHA
341,RAGHUNATHPUR                                      ,Cereals,2017-09-19 14:40:10.960,Paddy (Dhan),JAGATSINGHAPUR,Recommended to spray Validamycin(Sheathmar)/Hexaconazol(Contaf Plus) 2ml per litre of water to control sheath rot in Paddy,Sheath rot in Paddy,	Plant Protection	,KHARIF,AGRICULTURE,ODISHA
342,ERASAMA                                           ,Cereals,2017-09-20 18:12:01.447,Paddy (Dhan),JAGATSINGHAPUR,Recommended to spray Triazophos 40% EC 2.5ml per litre of water to control Rice Hispa,Rice Hispa,	Plant Protection	,KHARIF,AGRICULTURE,ODISHA
343,ERASAMA                                           ,Cereals,2017-09-21 17:01:39.247,Paddy (Dhan),JAGATSINGHAPUR,DETAIL PACKAGE OF PRACTICE EXPLAINED IN SRI METHOD PADDY CULTIVATION,SRI METHOD PADDY CULTIVATION,Cultural Practices,KHARIF,AGRICULTURE,ODISHA
344,JAGATSINGHPUR                                     ,Cereals,2017-09-21 19:43:19.540,Paddy (Dhan),JAGATSINGHAPUR,Recommended to spray Chlorpyrifos 20% EC 2.5ml per litre of water to control Swarming Caterpillar in Paddy,Swarming Caterpillar in Paddy,	Plant Protection	,KHARIF,AGRICULTURE,ODISHA
345,JAGATSINGHPUR                                     ,Vegetables,2017-09-22 18:48:12.940,Bhindi(Okra/Ladysfinger),JAGATSINGHAPUR,RECOMMENDED TO SPRAY RIDOMIL GOLD @ 2.5 GRAM / 1 LIT OF WATER,CERCOSPORA LEAF SPOT IN OKRA,	Plant Protection	,KHARIF,HORTICULTURE,ODISHA
346,ERASAMA                                           ,Vegetables,2017-09-23 11:13:33.313,Cauliflower,JAGATSINGHAPUR,DETAIL PACKAGE OF PRACTICE EXPLAINED IN CAULIFLOWER CULTIVATION,CAULIFLOWER CULTIVATION,Cultural Practices,KHARIF,HORTICULTURE,ODISHA
347,JAGATSINGHPUR                                     ,Vegetables,2017-09-24 08:06:12.543,Cauliflower,JAGATSINGHAPUR,"VARIETY OF CAULIFLOWER---PUSA SHUBADRA,SNOWBALL-1,MADHUMATI",VARIETY OF CAULIFLOWER,Cultural Practices,KHARIF,HORTICULTURE,ODISHA
348,JAGATSINGHPUR                                     ,Cereals,2017-09-25 13:22:09.880,Paddy (Dhan),JAGATSINGHAPUR,Recommended to spray Mancozeb 75% WP 2gm per litre of water twice at 7-10days interval to control Brown spot disease in Paddy,Brown spot disease in Paddy,	Plant Protection	,KHARIF,AGRICULTURE,ODISHA
