,BlockName,Category,CreatedOn,Crop,DistrictName,KCCAns,QueryText,QueryType,Season,Sector,StateName
128,MUMBAI,Plantation Crops,2017-08-28 17:32:32.117,Coconut,MUMBAI,Drenching of Chloropyriphos 40 ml / 15 lit of water.,Attack of White Grub ?,	Plant Protection	,KHARIF,HORTICULTURE,MAHARASHTRA
129,MUMBAI,Others,2017-08-30 11:41:49.697,Others,MUMBAI,CONTACT NUMBER FOR BEE KEEPING  TRAING CENTER MAHABALESHWAR - 02168 -260264,CONTACT NUMBER FOR BEE KEEPING,	Plant Protection	,KHARIF,AGRICULTURE,MAHARASHTRA
130,MUMBAI,Others,2017-09-05 19:49:39.290,Others,MUMBAI,"Partly cloudy,No Possibility of Rain.",Asking about weather forecast  ?,Weather,KHARIF,AGRICULTURE,MAHARASHTRA
131,MUMBAI,Cereals,2017-09-07 18:45:36.287,Wheat,MUMBAI,market rate of wheat  -rs 1400-2000  / quintal,asked about market rate of  wheat  ?,Market Information,KHARIF,AGRICULTURE,MAHARASHTRA
132,MUMBAI,Others,2017-09-07 19:12:33.720,Others,MUMBAI,This week weather is CLOUDY and LIGHT Possibility of Rainfall,Asking about weather forecast?,Weather,KHARIF,AGRICULTURE,MAHARASHTRA
133,MUMBAI,Others,2017-09-09 08:22:31.407,Others,MUMBAI,This week weather is CLOUDY and  of  Possibility LIGHT Rainfall,Asking about weather forecast?,Weather,KHARIF,AGRICULTURE,MAHARASHTRA
134,MUMBAI,Others,2017-09-09 09:16:17.313,Others,MUMBAI,This week weather is Partly cloudy and Possibility of Rainfall.,Asking about weather forecast?,Weather,KHARIF,AGRICULTURE,MAHARASHTRA
135,MUMBAI,Others,2017-09-11 12:58:26.997,Others,MUMBAI,"This week Cloudy Weather,Light Rainfall Chances .",ASKING ABOUT WEATHER FORECAST ?,Weather,KHARIF,AGRICULTURE,MAHARASHTRA
136,MUMBAI,Others,2017-09-12 20:20:12.800,Others,MUMBAI,THIS WEEK Cloudy Weather  Rainfall Chances .,ASKING ABOUT WEATHER FORECAST ?,Weather,RABI,AGRICULTURE,MAHARASHTRA
137,MUMBAI,Others,2017-09-13 09:59:42.417,Others,MUMBAI,This week weather is CLOUDY and  of  Possibility LIGHT To MEDIUM Rainfall,Asking about weather forecast?,Weather,KHARIF,AGRICULTURE,MAHARASHTRA
138,MUMBAI,Others,2017-09-13 15:18:20.023,Others,MUMBAI,"'
This week weather is CLOUDY and LIGHT Possibility of Rainfall",Asking about weather forecast?,Government Schemes,KHARIF,AGRICULTURE,MAHARASHTRA
139,MUMBAI,Others,2017-09-15 10:27:01.950,Others,MUMBAI,In this week Cloudy weather and rainfall chances.,Asking About Weather Forecast?,Weather,KHARIF,AGRICULTURE,MAHARASHTRA
140,MUMBAI,Fruits,2017-09-19 09:33:05.333,Mango,MUMBAI,Spray Nuwan 20 ml/ 15Lit of Water.,Attack  Stem Borer?,	Plant Protection	,KHARIF,HORTICULTURE,MAHARASHTRA
141,MUMBAI,Others,2017-09-24 10:01:47.030,Others,MUMBAI,This week weather is CLOUDY and  of  Possibility LIGHT Rainfall,Asking about weather forecast?,Weather,KHARIF,AGRICULTURE,MAHARASHTRA
142,MUMBAI,Others,2017-09-26 20:45:15.653,Others,MUMBAI,This week weather is CLOUDY and LIGHT Possibility of Rainfall,Asking about weather forecast?,Weather,KHARIF,AGRICULTURE,MAHARASHTRA
