,BlockName,Category,CreatedOn,Crop,DistrictName,KCCAns,QueryText,QueryType,Season,Sector,StateName
670,TIRUCHENGODU                                      ,Others,2017-03-18 17:54:48.363,Others,NAMAKKAL,recommended for having light rain today,asking about Namakkal district rainfall information,Weather,RABI,AGRICULTURE,TAMILNADU
671,NAMAGIRIPET                                       ,Others,2017-03-18 17:59:11.007,Others,NAMAKKAL,Recommended for Namakkal district today weather Report : moderate Rain fall (7.6 – 35.5 mm),asking about Namakkal district weather Report,Weather,RABI,AGRICULTURE,TAMILNADU
672,ERUMAPATTY                                        ,Condiments and Spices,2017-03-18 18:20:13.467,Turmeric,NAMAKKAL,"Recommended at Tiruchengode Bulb 7603 Rs/Quintal, Finger 7609 Rs/Quintal",Market rate for Turmeric,Market Information,JAYAD,HORTICULTURE,TAMILNADU
673,KABILAMALAI                                       ,Vegetables,2017-03-18 18:28:00.757,Brinjal,NAMAKKAL,recommended for malathion 2 ml /1 litre of water,asking about brinjal shoot borer and beetle management,Agriculture Mechanization,RABI,HORTICULTURE,TAMILNADU
674,ERUMAPATTY                                        ,Flowers,2017-03-18 19:58:18.803,Jasmine,NAMAKKAL,Recommended for spray GA3 50ppm 5gm / 100lit of water,Asked about jasmine growth regulator,Nutrient Management,RABI,HORTICULTURE,TAMILNADU
675,PUDUCHATRAM                                       ,Fiber Crops,2017-03-18 20:03:53.153,Cotton (Kapas),NAMAKKAL,Recommended for apply urea 33kg + super phosphate 100kg + potash 26kg / ac,cotton basal fertilizer management,Varieties,RABI,AGRICULTURE,TAMILNADU
676,PUDUCHATRAM                                       ,Flowers,2017-03-18 20:28:28.180,Jasmine,NAMAKKAL,recommended for profinophos 2 ml + carbendazim 2 gram /1 litre of water,asking about jasmine budworm and bud rot management,	Plant Protection	,RABI,HORTICULTURE,TAMILNADU
677,NAMAGIRIPET                                       ,Others,2017-03-19 06:48:52.633,Others,NAMAKKAL,recommended for today have cloudy weather,asking about Namakkal weather report,Weather,JAYAD,AGRICULTURE,TAMILNADU
678,ERUMAPATTY                                        ,Others,2017-03-19 09:02:30.640,Others,NAMAKKAL,Recommended for Namakkal district  Today No Rain Fall (0.0 mm),Namakkal district today weather Report,Weather,RABI,AGRICULTURE,TAMILNADU
679,NAMAGIRIPET                                       ,Sugar and Starch Crops,2017-03-19 10:34:52.000,Tapioca (Cassava),NAMAKKAL,recommended for apply neem cake - 10 gm/ acre,asking about tapioca termites management,	Plant Protection	,JAYAD,AGRICULTURE,TAMILNADU
680,KABILAMALAI                                       ,Plantation Crops,2017-03-19 17:21:57.293,Coconut,NAMAKKAL,recommended for the coconut spacing :  25' x 25' (7.5 x 7.5 m),asking about spacing details for coconut,Cultural Practices,RABI,HORTICULTURE,TAMILNADU
681,RASIPURAM                                         ,Vegetables,2017-03-19 18:31:13.637,Ribbed Gourd (Kali Tori),NAMAKKAL,Recommended for spray Borax 5 g/ litre of water,Boron deficiency in Ribbed gourd,Fertilizer Use and Availability,JAYAD,HORTICULTURE,TAMILNADU
682,NAMAKKAL                                          ,Others,2017-03-19 19:43:17.003,Others,NAMAKKAL,Recommended for villupuram  district Today No Rain Fall (0.0 mm),villupuram  district today weather Report,Nutrient Management,RABI,AGRICULTURE,TAMILNADU
683,ERUMAPATTY                                        ,Others,2017-03-19 20:31:56.550,Others,NAMAKKAL,Recommended for today having light rain occurring,Asking about weather report for namakkal district,Weather,JAYAD,AGRICULTURE,TAMILNADU
684,NAMAKKAL                                          ,Others,2017-03-19 21:25:10.787,Others,NAMAKKAL,Recommended for Namakkal district  Today No Rain Fall (0.0 mm),Namakkal district  today weather Report,Weather,RABI,AGRICULTURE,TAMILNADU
685,PUDUCHATRAM                                       ,Vegetables,2017-03-20 06:50:57.653,Snake Gourd,NAMAKKAL,recommended for spray Azadirachtin 3ml/ litre of water,asking about yellow mosaic in snake gourd,	Plant Protection	,RABI,HORTICULTURE,TAMILNADU
686,PALLIPALAYAM                                      ,Oilseeds,2017-03-20 10:09:13.940,Groundnut (pea nut/mung phalli),NAMAKKAL,recommended for  Kadiri-6 groundnut sowing season kharif (July –October),asking about Kadiri-6 groundnut sowing season,Varieties,RABI,AGRICULTURE,TAMILNADU
687,PALLIPALAYAM                                      ,Oilseeds,2017-03-20 10:13:23.450,Groundnut (pea nut/mung phalli),NAMAKKAL,Recommended for contact to TNAU  Department of Oilseeds ph 0422-2450812,CO 6 groundnut seeds availability,Seeds,RABI,AGRICULTURE,TAMILNADU
688,NAMAKKAL                                          ,Condiments and Spices,2017-03-20 11:03:51.190,Turmeric,NAMAKKAL,recommended for market rate for turmeric in Namagiripettai market for Bulb as Rs.5222 -7019/Quintal and Finger Rs. 5540-8522/Quintal,Turmeric market rate,Market Information,RABI,HORTICULTURE,TAMILNADU
689,ELACIPALAYAM                                      ,Fodder Crops,2017-03-20 11:18:49.513,Napier Grass,NAMAKKAL,recommended for contacting the Assistant Director of Horticulture + Namakkal 04286-280827,asking for the subsidy for raingun,Seeds,RABI,AGRICULTURE,TAMILNADU
690,RASIPURAM                                         ,Vegetables,2017-03-20 11:23:22.870,Brinjal,NAMAKKAL,recommended for may - june suitable for planting,asking about Brinjal suitable season,Cultural Practices,JAYAD,HORTICULTURE,TAMILNADU
691,NAMAKKAL                                          ,Others,2017-03-20 11:34:16.557,Others,NAMAKKAL,Recommended for Namakkal Today No Rain Fall (0.0 mm),Namakkal weather Report,Weather,RABI,AGRICULTURE,TAMILNADU
692,TIRUCHENGODU                                      ,Vegetables,2017-03-20 12:23:45.130,Onion,NAMAKKAL,Recommended for planting during April – May and October – November.,Asking about small onion planting season,Field Preparation,RABI,HORTICULTURE,TAMILNADU
693,NAMAGIRIPET                                       ,Others,2017-03-20 13:26:43.763,Others,NAMAKKAL,Recommended for Salem Today No Rain Fall (0.0 mm),Salem weather Report,Weather,JAYAD,AGRICULTURE,TAMILNADU
694,NAMAGIRIPET                                       ,Others,2017-03-20 13:35:13.783,Others,NAMAKKAL,Recommended for Namakkal district Today No Rain Fall (0.0 mm),Namakkal district today weather Report,Weather,RABI,AGRICULTURE,TAMILNADU
695,SENDAMANGALAM                                     ,Sugar and Starch Crops,2017-03-20 14:48:50.033,Tapioca (Cassava),NAMAKKAL,recommended for Azadirachtin 3 ml/litre of water,asking about Mosaic diseases in tapioca,	Plant Protection	,RABI,AGRICULTURE,TAMILNADU
696,ERUMAPATTY                                        ,Others,2017-03-20 16:35:21.770,Others,NAMAKKAL,recommended for Namakkal agricultural engineering department contact number  04286 27 54 72,asking about Namakkal agricultural engineering department contact number,Agriculture Mechanization	,RABI,AGRICULTURE,TAMILNADU
697,ERUMAPATTY                                        ,Others,2017-03-20 16:51:39.473,Others,NAMAKKAL,Recommended for rain gun diameter size 3 inch diameter,Asking about rain gun diameter size,Agriculture Mechanization	,RABI,AGRICULTURE,TAMILNADU
698,NAMAGIRIPET                                       ,Others,2017-03-20 18:42:44.713,Others,NAMAKKAL,Recommended for today and tomorrow  having light  rain occurring,Asking about weather report for salem district,Weather,JAYAD,AGRICULTURE,TAMILNADU
699,ERUMAPATTY                                        ,Others,2017-03-20 20:07:25.480,Others,NAMAKKAL,recommended for today have a light rain day,asking about Namakkal weather report,Weather,RABI,AGRICULTURE,TAMILNADU
700,NAMAGIRIPET                                       ,Others,2017-03-20 20:11:06.973,Others,NAMAKKAL,"Recommended to contact jainirrigation ,netafilm",Asking about drip irrigation information,Agriculture Mechanization	,RABI,AGRICULTURE,TAMILNADU
701,NAMAGIRIPET                                       ,Others,2017-03-21 10:38:01.720,Others,NAMAKKAL,Recommended for Namakkal Today No Rain Fall,asking about Namakkal today weather Report,Weather,RABI,AGRICULTURE,TAMILNADU
702,KABILAMALAI                                       ,Plantation Crops,2017-03-21 11:30:44.260,Coconut,NAMAKKAL,"Recommended Krishi Vigyan Kendra, Namakkal contact no. 04286 – 266345","asking about Krishi Vigyan Kendra, Namakkal contact no.",Nursery Management,RABI,HORTICULTURE,TAMILNADU
703,NAMAKKAL                                          ,Others,2017-03-21 15:40:18.083,Others,NAMAKKAL,Recommended for weather report of Namakkal is no rain today (0 mm) with cloudy weather,weather report of Namakkal,Weather,JAYAD,AGRICULTURE,TAMILNADU
704,NAMAGIRIPET                                       ,Others,2017-03-21 16:03:12.523,Others,NAMAKKAL,Recommended for Spray Borax 2 g/lit with proper water management,Asking about  Arecanut Nut crack management,Nutrient Management,RABI,AGRICULTURE,TAMILNADU
705,ELACIPALAYAM                                      ,Others,2017-03-21 17:18:26.217,Others,NAMAKKAL,Recommended for Namakkal Today No Rain Fall (0.0 mm),asking about Namakkal today weather Report,Weather,RABI,AGRICULTURE,TAMILNADU
706,NAMAKKAL                                          ,Others,2017-03-21 17:43:53.920,Others,NAMAKKAL,recommended for today and tommarrow cloudy weather and no possibility of rainfall,Asked about weather report information,Weather,RABI,AGRICULTURE,TAMILNADU
707,ERUMAPATTY                                        ,Plantation Crops,2017-03-21 18:04:57.860,Coconut,NAMAKKAL,Recommended for Root feeding of the tonic @ 200 ml / palm twice a year at six months interval,Asking about button shed in coconut,	Plant Protection	,RABI,HORTICULTURE,TAMILNADU
708,ERUMAPATTY                                        ,Flowers,2017-03-21 21:12:59.097,Jasmine,NAMAKKAL,recommended for apply Micro nutrient mixture 5kg/acre,Top dressing fertilizer application of jasmine,Nutrient Management,JAYAD,HORTICULTURE,TAMILNADU
709,PUDUCHATRAM                                       ,Vegetables,2017-03-22 07:45:50.010,Snake Gourd,NAMAKKAL,Recommended for setup yellow sticky trap 6/ac.,White fly in Snake gourd,	Plant Protection	,RABI,HORTICULTURE,TAMILNADU
710,NAMAKKAL                                          ,Others,2017-03-22 09:19:26.180,Others,NAMAKKAL,recommended for today and tommarrow cloudy weather and no possibility of rainfall,Asked about weather report information,Weather,JAYAD,AGRICULTURE,TAMILNADU
711,ERUMAPATTY                                        ,Others,2017-03-22 11:48:14.067,Others,NAMAKKAL,Recommended for having cloudy weather to light drizzle today,Asking about sendamangalam weather report,Weather,RABI,AGRICULTURE,TAMILNADU
712,RASIPURAM                                         ,Animal,2017-03-22 12:03:57.180,POULTRY  FARM ,NAMAKKAL,Recommended for contact number 04286-266345,Asking about Namakkal veterinary training centre,Integrated Farming,RABI,ANIMAL HUSBANDRY,TAMILNADU
713,NAMAGIRIPET                                       ,Others,2017-03-22 13:21:00.797,Others,NAMAKKAL,Recommended for today and tomorrow having cloudy weather occurring,Asking about Weather report for Namagiripettai,Weather,JAYAD,AGRICULTURE,TAMILNADU
714,RASIPURAM                                         ,Sugar and Starch Crops,2017-03-22 14:03:57.963,Tapioca (Cassava),NAMAKKAL,recommended for 19:19:19 complex  1.3 kg + 0-0-50 complex 10 kg + Urea 2.7 kg /acre /split,asking about tapioca fertigation,Nutrient Management,RABI,AGRICULTURE,TAMILNADU
715,NAMAGIRIPET                                       ,Others,2017-03-22 14:43:23.653,Others,NAMAKKAL,Recommended for Namakkal district Today No Rain Fall (0.0 mm),Asked about Namakkal district weather Report,Weather,RABI,AGRICULTURE,TAMILNADU
716,KOLLI HILLS                                       ,Flowers,2017-03-22 16:33:36.623,Jasmine,NAMAKKAL,Recommended for spray cycocel (B-Nine WSG) 5gm / 10lit,tuberose growth regulator,Nutrient Management,RABI,HORTICULTURE,TAMILNADU
717,ERUMAPATTY                                        ,Animal,2017-03-22 17:47:58.357,POULTRY  FARM ,NAMAKKAL,"Recommended to contact Veterinary University Training and Research Centre, kancheepuram, kattupakkam, contact no. 044 – 27452224",asking about poultry farming information,Animal Breeding,RABI,ANIMAL HUSBANDRY,TAMILNADU
718,ERUMAPATTY                                        ,Others,2017-03-22 20:48:00.383,Others,NAMAKKAL,Recommended for Namakkal Today No Rain Fall (0.0 mm),Asking about Namakkal weather Report,Weather,RABI,AGRICULTURE,TAMILNADU
719,ERUMAPATTY                                        ,Others,2017-03-22 21:18:39.740,Others,NAMAKKAL,Recommended for Namakkal district  Today No Rain Fall (0.0 mm),Namakkal district weather Report,Weather,RABI,AGRICULTURE,TAMILNADU
720,NAMAGIRIPET                                       ,Others,2017-03-23 10:29:41.483,Others,NAMAKKAL,Recommended for weather report for Namakkal district Partly Cloudy and no rain fall,weather report for namakkal district,Weather,RABI,AGRICULTURE,TAMILNADU
721,NAMAGIRIPET                                       ,Others,2017-03-23 11:26:31.417,Others,NAMAKKAL,Recommended for weather report for Namakkal district Partly Cloudy and no rain fall,weather report for Namakkal district,Weather,RABI,AGRICULTURE,TAMILNADU
722,NAMAKKAL                                          ,Others,2017-03-23 11:27:50.753,Others,NAMAKKAL,Recommended for today have light rainfall.,Weather report for Namakkal,Weather,RABI,AGRICULTURE,TAMILNADU
723,ERUMAPATTY                                        ,Others,2017-03-24 06:21:21.143,Others,NAMAKKAL,"Recommended for Today and tomorrow having cloudy weather and Possibility of light  Rainfall chances (Temperature will be 33 degree Celsius (°C), Precipitation Chances (23% ) , Humidity level will be (49 % ) Wind speed  6 km / hr .",Weather forecasting for  Namakkal district,Weather,JAYAD,AGRICULTURE,TAMILNADU
724,RASIPURAM                                         ,Vegetables,2017-03-24 17:54:45.510,Tomato,NAMAKKAL,Recommended for apply 12:61:0 -16kg+13:0:45 -89 kg +Urea 40 kg/acre on Flower initiation to flowering,Asking about fertigation in tomato,Fertilizer Use and Availability,RABI,HORTICULTURE,TAMILNADU
725,TIRUCHENGODU                                      ,Others,2017-03-24 18:41:26.657,Others,NAMAKKAL,"recommended for contact with Krishi Vigyan Kendra ,
Veterinary college & RI Campus, Namakkal, phone: 04286-266345",asking about need for vermicompost production training,Organic Farming,JAYAD,AGRICULTURE,TAMILNADU
726,NAMAGIRIPET                                       ,Others,2017-03-24 21:05:29.123,Others,NAMAKKAL,recommended for no rainfall today (0.0 milli meter ),asking for the weather forecast in Rasipuram of namakkal district,Weather,RABI,AGRICULTURE,TAMILNADU
727,RASIPURAM                                         ,Others,2017-03-25 09:36:22.750,Others,NAMAKKAL,recommended for phone number:0422-6611340 / 6611268,asking about Post Harvest Technology phone number,Post Harvest Preservation,RABI,AGRICULTURE,TAMILNADU
728,NAMAKKAL                                          ,Others,2017-03-25 12:12:23.483,Others,NAMAKKAL,Recommended for today have no rainfall.,Weather report for Namakkal,Weather,RABI,AGRICULTURE,TAMILNADU
729,NAMAGIRIPET                                       ,Others,2017-03-25 12:36:02.987,Others,NAMAKKAL,Recommended for today have no rainfall.,Weather report for Namakkal,Weather,RABI,AGRICULTURE,TAMILNADU
730,ERUMAPATTY                                        ,Condiments and Spices,2017-03-25 13:08:25.213,Turmeric,NAMAKKAL,recommended for market information of Turmeric at Erode is Bulb: 5399-7545 Rs/Quintal and Finger: 5509-8899 Rs/ quintal on 24/03/17,market information of Turmeric,Market Information,JAYAD,HORTICULTURE,TAMILNADU
731,ELACIPALAYAM                                      ,Others,2017-03-25 13:43:09.367,Others,NAMAKKAL,Recommended for next one week having no rainfall,Asking about weather report for Namakkal district,Weather,JAYAD,AGRICULTURE,TAMILNADU
732,ERUMAPATTY                                        ,Others,2017-03-25 13:56:16.817,Others,NAMAKKAL,recommended for today is not a rain day,asking about namakkal weather report,Weather,RABI,AGRICULTURE,TAMILNADU
733,NAMAGIRIPET                                       ,Animal,2017-03-25 16:22:32.970,"Bovine(Cow,Buffalo)",NAMAKKAL,"recommended for contacting at 04286 - 266345, 266244",asking for the disease management in cow,Disease Management,RABI,ANIMAL HUSBANDRY,TAMILNADU
734,NAMAGIRIPET                                       ,Animal,2017-03-25 16:25:17.620,POULTRY  FARM ,NAMAKKAL,Recommended for Namakkal District Veterinary University Training and Research Centre contact number  phone :04286-266345,Namakkal District Veterinary University Training and Research Centre contact number,Livestock Products Processing and Packaging,JAYAD,ANIMAL HUSBANDRY,TAMILNADU
735,NAMAGIRIPET                                       ,Vegetables,2017-03-25 17:25:27.493,Tomato,NAMAKKAL,Recommended for spray quizalofop ethyl 300ml/ac/200 lit of water,Weed management for tomato,"Water Management, Micro Irrigation",JAYAD,HORTICULTURE,TAMILNADU
736,NAMAKKAL                                          ,Sugar and Starch Crops,2017-03-25 17:51:29.167,Tapioca (Cassava),NAMAKKAL,Recommended for Spray ferrous sulphate 10 g + Zinc sulphate 5 g / lit of water at 60 and 90th day after planting .,Tapioca Micro nutrient deficiency,Nutrient Management,JAYAD,AGRICULTURE,TAMILNADU
737,TIRUCHENGODU                                      ,Others,2017-03-25 18:08:55.127,Others,NAMAKKAL,"recommended for contact to VCRI Campus, Mohanur Road, 
Namakkal - 637 001 04286-266345",Asked about azolla seeds availability,Seeds,JAYAD,AGRICULTURE,TAMILNADU
738,NAMAGIRIPET                                       ,Others,2017-03-25 19:01:11.050,Others,NAMAKKAL,Recommended for weather report Namakkal district no rain fall,weather report Namakkal district,Weather,RABI,AGRICULTURE,TAMILNADU
739,PUDUCHATRAM                                       ,Vegetables,2017-03-25 21:02:15.747,Bitter Gourd,NAMAKKAL,recommended for the spray of Acetamiprid at the rate of 4 gram in 10 litres of water,asking for the Jassids management in bitter gourd,	Plant Protection	,RABI,HORTICULTURE,TAMILNADU
740,NAMAKKAL                                          ,Others,2017-03-25 21:05:48.000,Others,NAMAKKAL,"Recommended for Today and tomorrow having cloudy weather and Possibility of light  Rainfall chances (Temperature will be 23 degree Celsius (°C), Precipitation Chances (0% ) , Humidity level will be ( 79 % ) Wind speed  5 km / hr .",Weather forecasting for  Namakkal district,Weather,JAYAD,AGRICULTURE,TAMILNADU
741,KABILAMALAI                                       ,Vegetables,2017-03-25 21:45:56.940,Onion,NAMAKKAL,recommended for contact to vegetables department TNAU 0422-6611283,Asked about small onion seeds availability,Seeds and Planting Material,JAYAD,HORTICULTURE,TAMILNADU
742,RASIPURAM                                         ,Fruits,2017-03-26 08:46:43.080,Banana,NAMAKKAL,"Recommended for Hand pick and destroy the caterpillar ,Collect and destroy the damaged plant parts Use light trap,Summer ploughing to expose to the pupae ,In severe infestation applyBacillus thuringenesis , Sray Chlorpyriphos 20% EC (Perfban, Terminator)2 ml / lit o f water.",Banana Cut warm control,	Plant Protection	,JAYAD,HORTICULTURE,TAMILNADU
743,ERUMAPATTY                                        ,Others,2017-03-26 09:48:50.540,Others,NAMAKKAL,Recommended for spray Methylo bacterium 1liter/ac/200 liter of water,Drought management in Tomato  field,	Water Management	,JAYAD,AGRICULTURE,TAMILNADU
744,PARAMATHY                                         ,Sugar and Starch Crops,2017-03-26 10:02:56.203,Tapioca (Cassava),NAMAKKAL,Recommended for apply urea 40 kg + potash 80 kg /ac,fertilizer management for tapioca,Nutrient Management,RABI,AGRICULTURE,TAMILNADU
745,ERUMAPATTY                                        ,Others,2017-03-26 10:07:18.630,Others,NAMAKKAL,Recommended for today there is no rainfall,Asking about weather report for namakkal,Weather,JAYAD,AGRICULTURE,TAMILNADU
746,MALLASAMUDRAM                                     ,Pulses,2017-03-26 10:27:58.277,Black Gram (urd bean),NAMAKKAL,Recommended for black gram season April - May and variety ADT 5,Asking about black gram season and variety,Varieties,RABI,AGRICULTURE,TAMILNADU
747,NAMAKKAL                                          ,Others,2017-03-26 12:44:30.150,Others,NAMAKKAL,"Recommended to contact  Veterinary University Training and Research Centre, Namakkal contact no. 04365 - 224123",Asking about chaff cutter machinery subsidy,Agriculture Mechanization,JAYAD,AGRICULTURE,TAMILNADU
748,KABILAMALAI                                       ,Condiments and Spices,2017-03-26 15:11:54.340,Turmeric,NAMAKKAL,recommended for turmeric market information 7129 7545 / quintal finger 8499 - 8899 / quintal,Asked about turmeric market information,Market Information,JAYAD,HORTICULTURE,TAMILNADU
749,TIRUCHENGODU                                      ,Fruits,2017-03-26 16:25:57.603,Banana,NAMAKKAL,recommended for apply calcium nitrate 25 kg/acre,calcium deficiency in banana,Nutrient Management,RABI,HORTICULTURE,TAMILNADU
750,SENDAMANGALAM                                     ,Flowers,2017-03-26 17:09:39.350,Jasmine,NAMAKKAL,recommended for spray spiromesifen 8 ml /10 lit of water,red spider mite in jasmine,	Plant Protection	,RABI,HORTICULTURE,TAMILNADU
751,TIRUCHENGODU                                      ,Sugar and Starch Crops,2017-03-26 17:37:45.697,Tapioca (Cassava),NAMAKKAL,Recommended for apply urea 40kg + super phosphate 225kg + potash 80kg / ac,asking about tapioca basal fertilizers,Fertilizer Use and Availability,JAYAD,AGRICULTURE,TAMILNADU
752,SENDAMANGALAM                                     ,Vegetables,2017-03-26 17:42:04.320,Onion,NAMAKKAL,recommended for Sowing season for small onion is April – May and October – November,Sowing season for small onion,Cultural Practices,RABI,HORTICULTURE,TAMILNADU
753,PALLIPALAYAM                                      ,Plantation Crops,2017-03-26 18:14:49.610,Coconut,NAMAKKAL,"Recommended for Apply  urea kg 1.23 ,super phosphate kg 2.000,potash 1.920 Borax 100g + 5 kg Neem cake /palm /year",Coconut nutrient application for above five year trees,Nutrient Management,JAYAD,HORTICULTURE,TAMILNADU
754,PUDUCHATRAM                                       ,Vegetables,2017-03-26 18:43:06.333,Snake Gourd,NAMAKKAL,recommended for Foliar spray ethrel 2.5ml/tank,Snake gourd ethrel application details,	Plant Protection	,RABI,HORTICULTURE,TAMILNADU
755,PUDUCHATRAM                                       ,Vegetables,2017-03-26 18:47:47.550,Snake Gourd,NAMAKKAL,Recommended for spray carbendazim 2 g/ litre of water,Gummy Stem Blight in Snake gourd,	Plant Protection	,JAYAD,HORTICULTURE,TAMILNADU
756,SENDAMANGALAM                                     ,Plantation Crops,2017-03-26 20:22:55.863,Arecanut,NAMAKKAL,Recommended for apply urea 220gm + super phosphate 250gm + potash 240gm / tree / year,asking about arecanut top dressing fertilizers,Fertilizer Use and Availability,JAYAD,HORTICULTURE,TAMILNADU
757,RASIPURAM                                         ,Vegetables,2017-03-27 10:55:13.940,Brinjal,NAMAKKAL,Recommended for spray imidacloprid 0.5 ml/lit of water,thirips in brinjal,	Plant Protection	,RABI,HORTICULTURE,TAMILNADU
758,NAMAGIRIPET                                       ,Others,2017-03-27 12:40:47.793,Others,NAMAKKAL,Recommended for Weather report of Namakkal is no rain today (0 mm),Weather report of Namakkal,Weather,JAYAD,AGRICULTURE,TAMILNADU
759,ERUMAPATTY                                        ,Oilseeds,2017-03-27 14:22:28.630,Groundnut (pea nut/mung phalli),NAMAKKAL,Recommended for copra market rate Rs 6724-7504/quintal,groundnut market rate,Market Information,JAYAD,AGRICULTURE,TAMILNADU
760,ERUMAPATTY                                        ,Oilseeds,2017-03-27 14:27:17.427,Groundnut (pea nut/mung phalli),NAMAKKAL,recommended for the  market rate of groundnut in Karur as Rs.4200-4400/Quintal,asking for the market rate of groundnut,Weather,RABI,AGRICULTURE,TAMILNADU
761,ERUMAPATTY                                        ,Oilseeds,2017-03-27 15:01:22.717,Groundnut (pea nut/mung phalli),NAMAKKAL,Recommended for Rs.6724-7504/Quintal,Villupuram Groundnut market price,Market Information,JAYAD,AGRICULTURE,TAMILNADU
762,ERUMAPATTY                                        ,Others,2017-03-27 15:26:05.347,Others,NAMAKKAL,recommended for today is not a rain day,asking about namakkal weather report,Weather,RABI,AGRICULTURE,TAMILNADU
763,ERUMAPATTY                                        ,Others,2017-03-27 16:00:29.073,Others,NAMAKKAL,recommended for having no rain (0 mm)today,asking about Namakkal district rainfall information,Weather,JAYAD,AGRICULTURE,TAMILNADU
764,TIRUCHENGODU                                      ,Vegetables,2017-03-27 16:34:39.263,Brinjal,NAMAKKAL,Recommended for spray Azadirachtin 3 ml/ litre of water,Thrips in brinjal,	Plant Protection	,JAYAD,HORTICULTURE,TAMILNADU
765,KOLLI HILLS                                       ,Sugar and Starch Crops,2017-03-27 17:10:14.393,Tapioca (Cassava),NAMAKKAL,Recommended for spray ferrous sulphate 10 g + zinc sulphate 5 g /lit of water on 60th and 90th day after planting,foliar spray for tapioca,Nutrient Management,RABI,AGRICULTURE,TAMILNADU
766,ERUMAPATTY                                        ,Flowers,2017-03-27 20:57:20.513,Jasmine,NAMAKKAL,Recommended for spray cycocel 0.5 ml /lit of water,flower increase in jasmine,Nutrient Management,RABI,HORTICULTURE,TAMILNADU
767,NAMAGIRIPET                                       ,Others,2017-03-28 07:43:23.893,Others,NAMAKKAL,recommended for having no rain (0 mm)today,asking about Namakkal district rainfall information,Weather,JAYAD,AGRICULTURE,TAMILNADU
