,BlockName,Category,CreatedOn,Crop,DistrictName,KCCAns,QueryText,QueryType,Season,Sector,StateName
2076,MALLASAMUDRAM                                     ,Others,2017-07-31 16:48:01.413,Others,NAMAKKAL,Recommended for today have light rainfall.,Asking about report for Namakkal,Weather,KHARIF,AGRICULTURE,TAMILNADU
2077,PALLIPALAYAM                                      ,Others,2017-07-31 16:54:56.933,Others,NAMAKKAL,recommeneded for having light rain today,asking about Namakkal district rainfall information,Weather,KHARIF,AGRICULTURE,TAMILNADU
2078,NAMAKKAL                                          ,Others,2017-07-31 18:16:23.987,Others,NAMAKKAL,Recommended to contact namakkal agriculture engineering department phone:04286 27 54 72,Asking about solar pumpset subsidy detail,Government Schemes,KHARIF,AGRICULTURE,TAMILNADU
2079,RASIPURAM                                         ,Others,2017-07-31 18:34:03.053,Others,NAMAKKAL,recommended for today and tommarrow cloudy weather and no possibility of rainfall,Asked about namakkal  weather report information,Weather,KHARIF,AGRICULTURE,TAMILNADU
2080,VENNANDUR                                         ,Vegetables,2017-07-31 19:24:00.783,Brinjal,NAMAKKAL,recommended for spray profenofos 2 ml / litre of water,Asked about epilacna beetle management,	Plant Protection	,KHARIF,HORTICULTURE,TAMILNADU
2081,ERUMAPATTY                                        ,Others,2017-07-31 20:27:07.987,Others,NAMAKKAL,Recommended for today having light to moderate rain,Asking about weather report for namakkal district,Weather,KHARIF,AGRICULTURE,TAMILNADU
2082,TIRUCHENGODU                                      ,Sugar and Starch Crops,2017-07-31 21:10:41.670,Tapioca (Cassava),NAMAKKAL,recommended for spray profenophos 2 ml + acephate 1 gm / lit of water,Asked about tapioca mealy bug management,	Plant Protection	,KHARIF,AGRICULTURE,TAMILNADU
2083,PUDUCHATRAM                                       ,Vegetables,2017-07-31 21:34:22.470,Chillies,NAMAKKAL,Recommended for spray dimethoate 2ml +neem oil 3 ml + sticking agent 0.5 ml / litre of water,Asking about Thrips management in chilly,	Plant Protection	,KHARIF,HORTICULTURE,TAMILNADU
2084,MALLASAMUDRAM                                     ,Fiber Crops,2017-08-01 08:50:53.253,Cotton (Kapas),NAMAKKAL,"Recommended for Winter Irrigated (Aug – Sep) varieties : MCU 5, Suvin, TCHB 213*, MCU 12, MCU 13, Surabhi",Asking about cotton sowing season and varieties,Varieties,KHARIF,AGRICULTURE,TAMILNADU
2085,ELACIPALAYAM                                      ,Pulses,2017-08-01 09:20:27.143,Bengal Gram (Gram/Chick Pea/Kabuli/Chana),NAMAKKAL,"recommended for Co 3,Co 4 is suitable",asking about suitable varieties for bengalgram (November),Varieties,KHARIF,AGRICULTURE,TAMILNADU
2086,NAMAKKAL                                          ,Animal,2017-08-01 10:02:24.120,POULTRY  FARM ,NAMAKKAL,Recommended for Namakkal Veterinary University Training and Research Centre contact number ph 04286-266345,Asking about Namakkal Veterinary University Training and Research Centre contact number,"Animal Production (Piggery, Goatery, Sheep Farming etc.)",KHARIF,ANIMAL HUSBANDRY,TAMILNADU
2087,NAMAGIRIPET                                       ,Condiments and Spices,2017-08-01 10:03:42.090,Turmeric,NAMAKKAL,"recommended for turmeric market information bulb 6600-8000 / quintal ,  finger 7000 - 9000/ quintal",Asked about Coimbatore turmeric market information,Market Information,KHARIF,HORTICULTURE,TAMILNADU
2088,NAMAKKAL                                          ,Others,2017-08-01 10:03:50.227,Others,NAMAKKAL,Recommended for agricultural application at kisan suvidha,Asking about agricultural application,Government Schemes,KHARIF,AGRICULTURE,TAMILNADU
2089,NAMAKKAL                                          ,Others,2017-08-01 10:09:23.723,Others,NAMAKKAL,Recommended for Namakkal district today weather Report : very Light Rain fall (0.1 – 2.4 mm),asking about Namakkal district today weather Report,Weather,KHARIF,AGRICULTURE,TAMILNADU
2090,PALLIPALAYAM                                      ,Animal,2017-08-01 11:01:31.923,"Bovine(Cow,Buffalo)",NAMAKKAL,"recommended for phone number:04286 - 266345, 266244",asking about Krishi Vigyan Kendra phone number,Disease Management,KHARIF,ANIMAL HUSBANDRY,TAMILNADU
2091,ERUMAPATTY                                        ,Cereals,2017-08-01 11:14:23.620,Paddy (Dhan),NAMAKKAL,Recommended to contact near nationalized bank,Asking about kisan credit card information,Fertilizer Use and Availability,KHARIF,AGRICULTURE,TAMILNADU
2092,ERUMAPATTY                                        ,Millets,2017-08-01 11:22:33.427,Sorghum (Jowar/Great Millet),NAMAKKAL,Recommended for Theni market rate : 1740 - 1820 Rs/Quintal,Asking about Market rate for sorghum,Market Information,KHARIF,AGRICULTURE,TAMILNADU
2093,ERUMAPATTY                                        ,Fiber Crops,2017-08-01 14:37:41.140,Cotton (Kapas),NAMAKKAL,Recommended to contact erumapatty agriculture department phone:04286-252225,Asking about cotton seed availability,Seeds,KHARIF,AGRICULTURE,TAMILNADU
2094,KOLLI HILLS                                       ,Oilseeds,2017-08-01 15:33:20.140,"Castor (Rehri, Rendi, Arandi) ",NAMAKKAL,Recommended for director of agriculture Namakkal -04286280465,Asking about castor seed availability,Sowing Time and Weather,KHARIF,AGRICULTURE,TAMILNADU
2095,NAMAKKAL                                          ,Others,2017-08-01 16:16:05.967,Others,NAMAKKAL,Recommended for Namakkal district today weather Report : very Light Rain fall (0.1 – 2.4 mm),asking about Namakkal district today weather Report,Weather,KHARIF,AGRICULTURE,TAMILNADU
2096,RASIPURAM                                         ,Vegetables,2017-08-01 17:06:49.770,Chillies,NAMAKKAL,recommended for spray azadiractin 3 ml/lit of water,asking about thrips control in chilli,	Plant Protection	,KHARIF,HORTICULTURE,TAMILNADU
2097,ERUMAPATTY                                        ,Flowers,2017-08-01 17:22:09.457,Jasmine,NAMAKKAL,Recommended for apply 4 kg Fym 130 g urea + 750 g super phosphate + 200 g potash / plant / year,Asking about Jasmine basal dressing fertilizer application,Nutrient Management,KHARIF,HORTICULTURE,TAMILNADU
2098,TIRUCHENGODU                                      ,Others,2017-08-01 19:16:58.317,Others,NAMAKKAL,recommended for today have a light rain day,asking about namakkal weather report,Weather,KHARIF,AGRICULTURE,TAMILNADU
2099,PALLIPALAYAM                                      ,Oilseeds,2017-08-02 07:05:53.430,Groundnut (pea nut/mung phalli),NAMAKKAL,recommended for hand weeding only,asking about weed management in groundnut,Weed Management,KHARIF,AGRICULTURE,TAMILNADU
2100,ERUMAPATTY                                        ,Oilseeds,2017-08-02 07:19:27.983,Groundnut (pea nut/mung phalli),NAMAKKAL,Recommended for spray Pendimethalin 600 ml / 200 lit of water / acre,Asking about pre emergence weed management in groundnut,Weed Management,KHARIF,AGRICULTURE,TAMILNADU
2101,NAMAKKAL                                          ,Plantation Crops,2017-08-02 07:50:50.903,Coconut,NAMAKKAL,Recommended for Namagiripettai Rs 8100-9200/quintal.,Asking about Market rate for copra,Market Information,KHARIF,HORTICULTURE,TAMILNADU
2102,MOHANUR                                           ,Vegetables,2017-08-02 08:33:50.703,Drum Stick,NAMAKKAL,Recommended for spray neem oil 3 ml / 1 lit of water,Asking about Pod fly management in drum stick,	Plant Protection	,KHARIF,HORTICULTURE,TAMILNADU
2103,MOHANUR                                           ,Pulses,2017-08-02 09:30:06.040,Pigeon pea (red gram/arhar/tur),NAMAKKAL,"recommended for contact to block level agricultural officer, ADA office, Mohanur",asking about subsidy details of Redgram,Government Schemes,KHARIF,AGRICULTURE,TAMILNADU
2104,NAMAGIRIPET                                       ,Others,2017-08-02 11:23:57.343,Others,NAMAKKAL,Recommended for salem today weather Report : moderate Rain fall (7.6 – 35.5 mm),asking about salem weather Report,Weather,KHARIF,AGRICULTURE,TAMILNADU
2105,KOLLI HILLS                                       ,Fruits,2017-08-02 12:26:52.640,Banana,NAMAKKAL,Recommended for spray potassium nitrate 1kg / 100lit,Asking about banana fruit size increases,Nutrient Management,KHARIF,HORTICULTURE,TAMILNADU
2106,RASIPURAM                                         ,Animal,2017-08-02 14:22:09.600,"Bovine(Cow,Buffalo)",NAMAKKAL,recommended for take pond size of 10*2*1 feet,asking about Azolla cultivation details,Dairy Production,KHARIF,ANIMAL HUSBANDRY,TAMILNADU
2107,NAMAKKAL                                          ,Fruits,2017-08-02 16:39:22.270,Guava,NAMAKKAL,recommended for potassium nitrate 5 gram /1 litre of water,asking about foliar spray in guava,Nutrient Management,KHARIF,HORTICULTURE,TAMILNADU
2108,MALLASAMUDRAM                                     ,Fruits,2017-08-02 18:05:48.860,Banana,NAMAKKAL,recommended for spray 19:19:19 - 5 gm/ lit of water,asking about banana nutrient management,Nutrient Management,JAYAD,HORTICULTURE,TAMILNADU
2109,NAMAKKAL                                          ,Plantation Crops,2017-08-03 08:04:53.633,Coconut,NAMAKKAL,Recommended for coconut intercrop :  Green manure crops and fodder crops (Napier grass and guinea grass) alone can be grown.,Asking about coconut intercropping information,Nutrient Management,KHARIF,HORTICULTURE,TAMILNADU
2110,NAMAKKAL                                          ,Others,2017-08-03 09:03:57.467,Others,NAMAKKAL,Recommended for Namakkal Today No Rain Fall (0.0 mm),asking about Namakkal weather Report,Weather,KHARIF,AGRICULTURE,TAMILNADU
2111,ERUMAPATTY                                        ,Others,2017-08-03 10:59:32.010,Others,NAMAKKAL,recommended for  Kisan Suvidha app,asking about new introducing app for farmers,Government Schemes,KHARIF,AGRICULTURE,TAMILNADU
2112,NAMAKKAL                                          ,Animal,2017-08-03 12:03:12.393,POULTRY  FARM ,NAMAKKAL,Recommended for Namakkal District Veterinary University Training and Research Centre contact number  phone :04567-231807,Namakkal District Veterinary University Training and Research Centre contact number,Livestock Products Processing and Packaging,KHARIF,ANIMAL HUSBANDRY,TAMILNADU
2113,PUDUCHATRAM                                       ,Others,2017-08-03 12:22:31.840,Others,NAMAKKAL,"Recommended Veterinary University Training and Research Centre, Namakkal contact no. 04286 - 266226",asking about Sheep farming information,Nutrient Management,JAYAD,AGRICULTURE,TAMILNADU
2114,KOLLI HILLS                                       ,Others,2017-08-03 12:48:13.350,Others,NAMAKKAL,"Recommended Veterinary University Training and Research Centre, Namakkal contact no. 04286 - 266226",asking about Sheep farming information,Varieties,JAYAD,AGRICULTURE,TAMILNADU
2115,NAMAGIRIPET                                       ,Oilseeds,2017-08-03 13:42:09.373,Groundnut (pea nut/mung phalli),NAMAKKAL,Recommended to contact block level Assistant Director of agriculture office,Asking about crop insurance scheme information,Crop Insurance,KHARIF,AGRICULTURE,TAMILNADU
2116,PALLIPALAYAM                                      ,Others,2017-08-03 14:24:42.947,Others,NAMAKKAL,Recommended for Namakkal today weather Report : very Light Rain fall (0.1 – 2.4 mm),Asking about Namakkal today weather Report,Weather,KHARIF,AGRICULTURE,TAMILNADU
2117,ELACIPALAYAM                                      ,Others,2017-08-03 15:36:39.450,Others,NAMAKKAL,recommended for today have a light rain day,asking about namakkal weather report,Weather,KHARIF,AGRICULTURE,TAMILNADU
2118,PUDUCHATRAM                                       ,Vegetables,2017-08-03 18:15:52.280,Brinjal,NAMAKKAL,Recommended for season May – June.,Asking about sowing season for Brinjal,Field Preparation,KHARIF,HORTICULTURE,TAMILNADU
2119,NAMAKKAL                                          ,Others,2017-08-03 18:59:43.197,Others,NAMAKKAL,Recommended for today have light rainfall.,Asking about Weather report for Namakkal,Weather,KHARIF,AGRICULTURE,TAMILNADU
2120,NAMAKKAL                                          ,Animal,2017-08-03 20:27:09.653,POULTRY  FARM ,NAMAKKAL,Recommended for Namakkal District Veterinary University Training and Research Centre contact number  phone :04286-266345,Namakkal District Veterinary University Training and Research Centre contact number,Livestock Products Processing and Packaging,KHARIF,ANIMAL HUSBANDRY,TAMILNADU
2121,NAMAKKAL                                          ,Others,2017-08-03 20:49:00.053,Others,NAMAKKAL,Recommended for Namakkal today weather Report : very Light Rain fall (0.1 – 2.4 mm),Asked about Namakkal today weather Report,Nutrient Management,JAYAD,AGRICULTURE,TAMILNADU
2122,NAMAKKAL                                          ,Others,2017-08-03 20:52:12.930,Others,NAMAKKAL,Recommended for Namakkal today weather Report : very Light Rain fall (0.1 – 2.4 mm),Asking about Namakkal today weather Report,Weather,JAYAD,AGRICULTURE,TAMILNADU
2123,PUDUCHATRAM                                       ,Others,2017-08-03 21:19:16.377,Others,NAMAKKAL,Recommended for today have light rainfall.,Asking about weather report for Namakkal,Weather,KHARIF,AGRICULTURE,TAMILNADU
2124,NAMAKKAL                                          ,Others,2017-08-04 07:13:42.833,Others,NAMAKKAL,"recommended for contact with Soil Testing Laboratory, namakkal, phone: 9443306266",asking about need for soil testing,Soil Testing,JAYAD,AGRICULTURE,TAMILNADU
2125,NAMAKKAL                                          ,Others,2017-08-04 07:30:31.793,Others,NAMAKKAL,"Recommended for crop insurance office, chennai contact no. 044 – 43403400",asking about crop insurance information,Crop Insurance,KHARIF,AGRICULTURE,TAMILNADU
2126,NAMAKKAL                                          ,Others,2017-08-04 07:40:03.390,Others,NAMAKKAL,Recommended for today have no rain,Asking about weather detail for namakkal dist,Weather,KHARIF,AGRICULTURE,TAMILNADU
2127,ERUMAPATTY                                        ,Vegetables,2017-08-04 07:45:50.893,Onion,NAMAKKAL,Recommended for spray Mancozeb 2 g /lit of water,asking about Leaf Blight management in onion,	Plant Protection	,KHARIF,HORTICULTURE,TAMILNADU
2128,RASIPURAM                                         ,Animal,2017-08-04 07:55:03.617,"Bovine(Cow,Buffalo)",NAMAKKAL,recommended for contact with nearest veterinary department,asking about need for animal insurance,Disease Management,JAYAD,ANIMAL HUSBANDRY,TAMILNADU
2129,RASIPURAM                                         ,Others,2017-08-04 08:37:57.700,Others,NAMAKKAL,Recommended for Namakkal today weather Report : Light Rain fall (2.5 – 7.5 mm),asking about Namakkal today weather Report,Weather,KHARIF,AGRICULTURE,TAMILNADU
2130,RASIPURAM                                         ,Animal,2017-08-04 09:40:43.443,POULTRY  FARM ,NAMAKKAL,"recommended for contact with Veterinary College and Research Institute, mohanur, phone:  04286 220 650",asking about need for poultry farm training,Animal Breeding,JAYAD,ANIMAL HUSBANDRY,TAMILNADU
2131,PALLIPALAYAM                                      ,Sugar and Starch Crops,2017-08-04 10:07:55.657,Sugarcane (Noble Cane),NAMAKKAL,Recommended for contact number 0422-6611214,Asking about Coimbatore entomology department,	Plant Protection	,KHARIF,AGRICULTURE,TAMILNADU
2132,MALLASAMUDRAM                                     ,Vegetables,2017-08-04 10:22:12.600,Cucumber,NAMAKKAL,Recommended for spray neem oil 3 ml/lit of water,Asking about  mosaic virus in cucumber,	Plant Protection	,KHARIF,HORTICULTURE,TAMILNADU
2133,SENDAMANGALAM                                     ,Vegetables,2017-08-04 10:39:00.733,Bhindi(Okra/Ladysfinger),NAMAKKAL,recommended for spray profenophos 2 ml/lit of water,asking about beetles control in bhendi,	Plant Protection	,KHARIF,HORTICULTURE,TAMILNADU
2134,TIRUCHENGODU                                      ,Pulses,2017-08-04 13:20:48.480,Black Gram (urd bean),NAMAKKAL,"recommended for VBN (Bg) 4, VBN(Bg) 5, TNAU (Black gram) VBN 7,VBN 8 are suitable",asking about suitable varieties for Blackgram (Adipattam),Nutrient Management,KHARIF,AGRICULTURE,TAMILNADU
2135,PARAMATHY                                         ,Sugar and Starch Crops,2017-08-04 13:45:04.027,Tapioca (Cassava),NAMAKKAL,Recommended for apply urea 40kg + potash 80kg / ac,tapioca top dressing fertilizer management,Nutrient Management,KHARIF,AGRICULTURE,TAMILNADU
2136,PARAMATHY                                         ,Sugar and Starch Crops,2017-08-04 13:47:31.743,Tapioca (Cassava),NAMAKKAL,Recommended for apply micro mixture 5kg / ac,asking about Tapioca fertilizer management,Nutrient Management,KHARIF,AGRICULTURE,TAMILNADU
2137,NAMAKKAL                                          ,Cereals,2017-08-04 13:57:56.210,Paddy (Dhan),NAMAKKAL,Recommended for apply urea 25 kg + potash 15 kg + neem cake 5 kg / ac,paddy top dressing fertilizer management,Fertilizer Use and Availability,KHARIF,AGRICULTURE,TAMILNADU
2138,PUDUCHATRAM                                       ,Animal,2017-08-04 14:59:17.580,"Bovine(Cow,Buffalo)",NAMAKKAL,Recommended for contact to Animal husbandary department,Asking about cattle insurance detail,Disease Reporting,KHARIF,ANIMAL HUSBANDRY,TAMILNADU
2139,TIRUCHENGODU                                      ,Flowers,2017-08-04 15:23:03.580,Jasmine,NAMAKKAL,Recommended for spray Thiamethoxam 4 gram  / 10 litre of water,Asking about thrips in Jasmine,	Plant Protection	,KHARIF,HORTICULTURE,TAMILNADU
2140,NAMAKKAL                                          ,Animal,2017-08-04 17:07:40.327,"Bovine(Cow,Buffalo)",NAMAKKAL,Recommended for contact to Animal husbandary department,Asking about cattle insurance detail,Disease Reporting,KHARIF,ANIMAL HUSBANDRY,TAMILNADU
2141,PARAMATHY                                         ,Sugar and Starch Crops,2017-08-04 18:41:37.210,Tapioca (Cassava),NAMAKKAL,recommended for urea 38 kg + potash 77 kg/acre 7 vathu,asking about tapioca top fertilizer management,Nutrient Management,KHARIF,AGRICULTURE,TAMILNADU
2142,PARAMATHY                                         ,Sugar and Starch Crops,2017-08-04 18:42:21.777,Tapioca (Cassava),NAMAKKAL,recommended for urea 38 kg + potash 77 kg/acre,asking about tapioca top fertilizer management,Nutrient Management,KHARIF,AGRICULTURE,TAMILNADU
2143,ERUMAPATTY                                        ,Others,2017-08-04 19:12:25.087,Others,NAMAKKAL,Recommended for apply urea 25 kg + potash 15 kg + neem cake 5 kg / ac,paddy top dressing fertilizer management,Nutrient Management,JAYAD,AGRICULTURE,TAMILNADU
2144,NAMAGIRIPET                                       ,Others,2017-08-04 19:16:21.907,Others,NAMAKKAL,recommended for having light rain today,asking about Salem district rainfall information,Weather,KHARIF,AGRICULTURE,TAMILNADU
2145,PARAMATHY                                         ,Others,2017-08-04 20:36:53.010,Others,NAMAKKAL,Recommended for Namakkal today weather Report : very Light Rain fall (0.1 – 2.4 mm),Asking about Namakkal today weather Report,Weather,KHARIF,AGRICULTURE,TAMILNADU
2146,PARAMATHY                                         ,Vegetables,2017-08-04 20:41:20.480,Brinjal,NAMAKKAL,Recommended for soil drenching chlorpyriphos 2.5ml/lit of water,asking about white grub in brinjal,	Plant Protection	,KHARIF,HORTICULTURE,TAMILNADU
2147,ERUMAPATTY                                        ,Others,2017-08-04 20:44:46.957,Others,NAMAKKAL,Recommended for today and tomorrow having cloudy weather occurring,Weather report for Namakkal district,Weather,KHARIF,AGRICULTURE,TAMILNADU
2148,ERUMAPATTY                                        ,Others,2017-08-04 20:46:26.660,Others,NAMAKKAL,recommended for having light rain today,asking about Namakkal district rainfall information,Weather,KHARIF,AGRICULTURE,TAMILNADU
2149,PARAMATHY                                         ,Others,2017-08-04 20:53:42.560,Others,NAMAKKAL,Recommended for today have no rain,asking about weather detail for namakkal dist,Weather,KHARIF,AGRICULTURE,TAMILNADU
2150,PARAMATHY                                         ,Others,2017-08-04 21:30:55.230,Others,NAMAKKAL,Recommended for today have no rain,Asking about weather detail for namakkal dist,Weather,KHARIF,AGRICULTURE,TAMILNADU
2151,MOHANUR                                           ,Millets,2017-08-05 08:04:52.417,Sorghum (Jowar/Great Millet),NAMAKKAL,Recommended for apply urea 34 kg + super phosphate 50 kg / acre,Asking about rain fed sorghum basal fertilizer application,Nutrient Management,KHARIF,AGRICULTURE,TAMILNADU
2152,PALLIPALAYAM                                      ,Plantation Crops,2017-08-05 11:34:41.710,Coconut,NAMAKKAL,recommended for root feeding with TNAU coconut tonic - 200 ml/ tree,asking about coconut button shedding management,Nutrient Management,JAYAD,HORTICULTURE,TAMILNADU
2153,TIRUCHENGODU                                      ,Fruits,2017-08-05 11:57:26.080,Banana,NAMAKKAL,Recommended for spray potassium sulphate 10 - 15gm / lit,asking about banana fruit size increases,Nutrient Management,KHARIF,HORTICULTURE,TAMILNADU
2154,SENDAMANGALAM                                     ,Others,2017-08-05 12:02:02.233,Others,NAMAKKAL,"Recommended for Executive Engineer (AE), No.1/597. P.S.K. Towers, Salem Road, Nammakkal District contact no. 04286 - 275472","asking about Executive Engineer (AE), Nammakkal contact no.",Seeds,KHARIF,AGRICULTURE,TAMILNADU
2155,NAMAGIRIPET                                       ,Others,2017-08-05 15:18:55.813,Others,NAMAKKAL,Recommended for weather report namakkal district have moderate rain fall,Asking about weather report for Namakkal district,Weather,KHARIF,AGRICULTURE,TAMILNADU
2156,ERUMAPATTY                                        ,Others,2017-08-05 16:46:07.890,Others,NAMAKKAL,recommended for today have light rain,asking about namakkal weather report,Weather,JAYAD,AGRICULTURE,TAMILNADU
2157,NAMAKKAL                                          ,Fruits,2017-08-05 17:55:14.457,Citrus,NAMAKKAL,"recommended for contact with Krishi Vigyan Kendra, namakkal, phone: 04286-266345",asking about need for citrus seedlings,Seeds and Planting Material,JAYAD,HORTICULTURE,TAMILNADU
2158,NAMAKKAL                                          ,Fruits,2017-08-05 18:14:58.583,Citrus,NAMAKKAL,Recommended to contact Periyakulam HC &RI phone:04546-231726,Asking about citrus seedling availability,Vegetative Propagation and Tissue Culture,KHARIF,HORTICULTURE,TAMILNADU
2159,ERUMAPATTY                                        ,Others,2017-08-05 19:53:23.677,Others,NAMAKKAL,recommended for today have a light rain day,asking about namakkal weather report,Weather,KHARIF,AGRICULTURE,TAMILNADU
2160,VENNANDUR                                         ,Pulses,2017-08-05 20:03:01.710,Black Gram (urd bean),NAMAKKAL,recommended for using neem leaf and nochi leaf,asking about blackgram post harvest management,Post Harvest Preservation,JAYAD,AGRICULTURE,TAMILNADU
2161,RASIPURAM                                         ,Vegetables,2017-08-06 06:49:46.043,Tomato,NAMAKKAL,recommended for apply neem cake - 10 kg/ acre,asking about tomato root grub management,	Plant Protection	,JAYAD,HORTICULTURE,TAMILNADU
2162,RASIPURAM                                         ,Others,2017-08-06 09:01:08.923,Others,NAMAKKAL,Recommended for Dharmapuri today weather Report : Light Rain fall (2.5 – 7.5 mm),asking about Dharmapuri today weather Report,Weather,KHARIF,AGRICULTURE,TAMILNADU
2163,TIRUCHENGODU                                      ,Others,2017-08-06 10:58:55.523,Others,NAMAKKAL,recommended have hand weeding only,weed management in fodder crops,Weed Management,KHARIF,AGRICULTURE,TAMILNADU
2164,NAMAKKAL                                          ,Others,2017-08-06 11:37:01.263,Others,NAMAKKAL,Recommended for Namakkal today weather Report : very Light Rain fall (0.1 – 2.4 mm),Namakkal today weather Report,"Power, Roads etc.",JAYAD,AGRICULTURE,TAMILNADU
2165,KABILAMALAI                                       ,Condiments and Spices,2017-08-06 13:32:27.890,Turmeric,NAMAKKAL,Recommended for spray Carbendazim 2 gram /litre of water.,Asking about leaf blotch in Turmeric,	Plant Protection	,KHARIF,HORTICULTURE,TAMILNADU
2166,KOLLI HILLS                                       ,Condiments and Spices,2017-08-06 13:53:52.510,Pepper,NAMAKKAL,recommended for chloropiriphos 2 ml /1 litre of water,asking about termite management in pepper,	Plant Protection	,KHARIF,HORTICULTURE,TAMILNADU
2167,TIRUCHENGODU                                      ,Others,2017-08-06 14:21:58.070,Others,NAMAKKAL,recommended for today have a light rain day,asking about namakkal weather report,Weather,KHARIF,AGRICULTURE,TAMILNADU
2168,PALLIPALAYAM                                      ,Fruits,2017-08-06 15:38:59.930,Pomegranate,NAMAKKAL,recommended for spray mancozeb 2 gm /lit of water,asking about Leaf Spot or Blight control in pomegranate,	Plant Protection	,KHARIF,HORTICULTURE,TAMILNADU
2169,NAMAGIRIPET                                       ,Others,2017-08-06 19:56:41.253,Others,NAMAKKAL,Recommended for Namakkal today weather Report : very Light Rain fall (0.1 – 2.4 mm),Asked about Namakkal today weather Report,Nutrient Management,JAYAD,AGRICULTURE,TAMILNADU
2170,PUDUCHATRAM                                       ,Flowers,2017-08-07 07:38:15.740,Jasmine,NAMAKKAL,Recommended for spray Fipronil 2.5 ml/lit of water,asking about Flower thrips control in jasmine,	Plant Protection	,KHARIF,HORTICULTURE,TAMILNADU
2171,RASIPURAM                                         ,Others,2017-08-07 08:22:30.003,Others,NAMAKKAL,recommended for the fertilizes : today have rain,Asking about weather report for Namakkal,Weather,KHARIF,AGRICULTURE,TAMILNADU
2172,SENDAMANGALAM                                     ,Others,2017-08-07 08:41:09.783,Others,NAMAKKAL,recommended for TNAU mushroom training dept contact -0422 -6611336,Mushroomt raining TNAU mushroom dept contact,Training and Exposure Visits,KHARIF,AGRICULTURE,TAMILNADU
