,BlockName,Category,CreatedOn,Crop,DistrictName,KCCAns,QueryText,QueryType,Season,Sector,StateName
1335,NAMAGIRIPET                                       ,Others,2017-05-23 16:07:04.700,Others,NAMAKKAL,"recommended for VAAPS agriculture training centre,salem, phone; 9944392870",asking about need for kitchen garden training,Training and Exposure Visits,JAYAD,AGRICULTURE,TAMILNADU
1336,VENNANDUR                                         ,Fruits,2017-05-23 16:18:56.367,Banana,NAMAKKAL,Recommended for soaked with banana sucker carbendasim 1 g in 1 lit of water.,Asking about banana sucker treatment,	Plant Protection	,JAYAD,HORTICULTURE,TAMILNADU
1337,RASIPURAM                                         ,Sugar and Starch Crops,2017-05-23 16:23:48.877,Tapioca (Cassava),NAMAKKAL,Recommended for intercropping tapioca short duration pulses and vegetable,Asking about intercropping tapicoa,Cultural Practices,JAYAD,AGRICULTURE,TAMILNADU
1338,NAMAGIRIPET                                       ,Plantation Crops,2017-05-23 17:13:48.137,Coconut,NAMAKKAL,Recommended to contact State Horticulture Farm – Semmedu Phone:04286-280827,Asking about coconut seedling availability,Seeds and Planting Material,JAYAD,HORTICULTURE,TAMILNADU
1339,MOHANUR                                           ,Others,2017-05-23 17:33:11.913,Others,NAMAKKAL,Recommended for Namakkal today weather Report : very Light Rain fall (0.1 – 2.4 mm),Asked about Namakkal weather Report,Nutrient Management,JAYAD,AGRICULTURE,TAMILNADU
1340,MOHANUR                                           ,Millets,2017-05-23 17:37:20.640,Maize (Makka),NAMAKKAL,Recommended for apply urea 40kg / acre,Asked about sorghum top dressing fertilizer management,Nutrient Management,JAYAD,AGRICULTURE,TAMILNADU
1341,TIRUCHENGODU                                      ,Oilseeds,2017-05-23 17:38:49.070,Groundnut (pea nut/mung phalli),NAMAKKAL,Recommended for apply gypsum 150kg / acre,groundnut top dressing fertilizer management,Nutrient Management,JAYAD,AGRICULTURE,TAMILNADU
1342,NAMAKKAL                                          ,Flowers,2017-05-23 18:05:46.420,Jasmine,NAMAKKAL,Recommended for apply FYM 10 kg / pit,Asking about jasmine basal fertilizer management,Nutrient Management,JAYAD,HORTICULTURE,TAMILNADU
1343,ELACIPALAYAM                                      ,Others,2017-05-23 18:15:31.543,Others,NAMAKKAL,Recommended for Treat the seeds with Trichoderma viride @ 4 g/kg seed or Pseudomonas fluorescens @ 10 g/kg seed,Asked about groundnut seed treatment information,Nutrient Management,JAYAD,AGRICULTURE,TAMILNADU
1344,ELACIPALAYAM                                      ,Oilseeds,2017-05-23 18:16:50.647,Groundnut (pea nut/mung phalli),NAMAKKAL,Recommended for groundnut foliar spray TNAU Groundnut rich 2kg / ac / 200 lit,Asked about groundnut foliar application,Organic Farming,JAYAD,AGRICULTURE,TAMILNADU
1345,NAMAGIRIPET                                       ,Pulses,2017-05-24 06:22:14.187,Black Gram (urd bean),NAMAKKAL,"recommended for Adipattam (June - July) and Co 6, Co(Gg) 7, VBN 2, VBN(Gg) 3",asking about sowing season and varieties of green gram,Cultural Practices,JAYAD,AGRICULTURE,TAMILNADU
1346,ELACIPALAYAM                                      ,Others,2017-05-24 06:36:20.247,Others,NAMAKKAL,Recommended for Namakkal today weather Report : Light Rain fall (2.5 – 7.5 mm),Namakkal today weather Report,Weather,JAYAD,AGRICULTURE,TAMILNADU
1347,RASIPURAM                                         ,Vegetables,2017-05-24 07:17:40.510,Ridge Gourd,NAMAKKAL,recommended for fibronil 1.5 ml /1 litre of water,asking about yellow mosaic disease management in ridge gourd,	Plant Protection	,JAYAD,HORTICULTURE,TAMILNADU
1348,ERUMAPATTY                                        ,Vegetables,2017-05-24 07:42:08.427,Onion,NAMAKKAL,recommended for market price of onion is rs.100-110/kg,asking about market price of onion,Market Information,JAYAD,HORTICULTURE,TAMILNADU
1349,PUDUCHATRAM                                       ,Others,2017-05-24 08:13:55.160,Others,NAMAKKAL,recommended for market price of cocoon is rs.360-531/kg,asking about market price of cocoon,Market Information,JAYAD,AGRICULTURE,TAMILNADU
1350,KOLLI HILLS                                       ,Plantation Crops,2017-05-24 09:01:30.203,Sal Wood,NAMAKKAL,recommended for Hook out the grub from the bore hole - apply monocrotophos 10 ml/ hole,asking about stem borer control in silver oak,	Plant Protection	,JAYAD,HORTICULTURE,TAMILNADU
1351,NAMAKKAL                                          ,Others,2017-05-24 10:02:41.330,Others,NAMAKKAL,recommended for today have a light rain day,asking about namakkal weather report,Weather,JAYAD,AGRICULTURE,TAMILNADU
1352,NAMAGIRIPET                                       ,Others,2017-05-24 10:39:05.720,Others,NAMAKKAL,"Recommended Namakkal Veterinary University Training and Research Centre, contact no. 04286 - 266345",asking about veterinary farm information,Storage,JAYAD,AGRICULTURE,TAMILNADU
1353,NAMAGIRIPET                                       ,Vegetables,2017-05-24 10:49:00.833,Mushroom,NAMAKKAL,Recommended for contact number  0422-6611336.,Asking about mushroom training centre Coimbatore,Training and Exposure Visits,JAYAD,HORTICULTURE,TAMILNADU
1354,MOHANUR                                           ,Condiments and Spices,2017-05-24 11:24:05.303,Turmeric,NAMAKKAL,recommended for market rate of turmeric at Namagiripettai	 are Bulb: 4983- 6657 Rs/Quintal and Finger:	5623-7989 Rs/Quintal on 23/05/17,Asking about market rate of turmeric,Market Information,JAYAD,HORTICULTURE,TAMILNADU
1355,PALLIPALAYAM                                      ,Animal,2017-05-24 11:58:40.793,"Bovine(Cow,Buffalo)",NAMAKKAL,"recommended for contact number of Veterinary College and Research Institute, Namakkal ph: 04286-266494","asking about contact to Veterinary College and Research Institute, Namakkal","Animal Production (Piggery, Goatery, Sheep Farming etc.)",JAYAD,ANIMAL HUSBANDRY,TAMILNADU
1356,MALLASAMUDRAM                                     ,Condiments and Spices,2017-05-24 18:37:01.293,Turmeric,NAMAKKAL,Recommended for apply 21.739 urea + 150 kg super phosphate + 40 potash + 12 kg ferrous sulphate + 6 kg zinc sulphate / Acre apply as basal,Asking About Turmeric basal dressing fertilizer application,Nutrient Management,JAYAD,HORTICULTURE,TAMILNADU
1357,TIRUCHENGODU                                      ,Others,2017-05-24 18:42:18.730,Others,NAMAKKAL,Recommended for contact number 04288-242996,Asking about Pallipalayam agriculture department,Agriculture Mechanization,JAYAD,AGRICULTURE,TAMILNADU
1358,TIRUCHENGODU                                      ,Sugar and Starch Crops,2017-05-24 19:05:28.657,Tapioca (Cassava),NAMAKKAL,Recommended for apply urea 40kg + potash 80kg / ac,tapioca top dressing fertilizer management,Nutrient Management,JAYAD,AGRICULTURE,TAMILNADU
1359,TIRUCHENGODU                                      ,Sugar and Starch Crops,2017-05-24 19:12:46.637,Tapioca (Cassava),NAMAKKAL,Recommended for apply urea 40 kg+ potash 80 kg /ac.,Asking about tapioca top dressing fertilizer management,Fertilizer Use and Availability,JAYAD,AGRICULTURE,TAMILNADU
1360,ELACIPALAYAM                                      ,Others,2017-05-24 20:47:04.150,Others,NAMAKKAL,Recommended for today have  light rainfall.,Asking about Weather report for Namakkal,Weather,JAYAD,AGRICULTURE,TAMILNADU
1361,RASIPURAM                                         ,Plantation Crops,2017-05-25 09:23:31.290,Coconut,NAMAKKAL,Recommended for  Coconut Research Station contact number 04253-288722,Asked about Coconut Research Station contact number,Nutrient Management,JAYAD,HORTICULTURE,TAMILNADU
1362,PUDUCHATRAM                                       ,Plantation Crops,2017-05-25 09:50:38.943,Coconut,NAMAKKAL,Recommended for root feeding TNAU coconut tonic 200 ml / tree once in 6 month .,Asked about Button shedding in coconut,Nutrient Management,JAYAD,HORTICULTURE,TAMILNADU
1363,TIRUCHENGODU                                      ,Others,2017-05-25 10:00:16.927,Others,NAMAKKAL,Recommended for Medicinal coleus planting season is done during June – July.,asking about Medicinal coleus planting season,Seeds,JAYAD,AGRICULTURE,TAMILNADU
1364,TIRUCHENGODU                                      ,Flowers,2017-05-25 15:53:48.730,Marigold,NAMAKKAL,Recommended for apply FYM 10 ton + urea 36kg + super phosphate 216kg + potash 30kg / acre,asking about marigold basal fertilizer management,Nutrient Management,JAYAD,HORTICULTURE,TAMILNADU
1365,KABILAMALAI                                       ,Plantation Crops,2017-05-25 16:32:42.950,Coconut,NAMAKKAL,recommended for Namakkal copra market rate Rs. 8000-8100/quintal,asking about Namakkal copra market rate,Market Information,JAYAD,HORTICULTURE,TAMILNADU
1366,KABILAMALAI                                       ,Oilseeds,2017-05-25 17:41:51.563,Groundnut (pea nut/mung phalli),NAMAKKAL,Recommended for apply gypsum 150 kg / acre,groundnut top dressing fertilizer management,Nutrient Management,JAYAD,AGRICULTURE,TAMILNADU
1367,KABILAMALAI                                       ,Oilseeds,2017-05-25 17:47:04.667,Groundnut (pea nut/mung phalli),NAMAKKAL,Recommended for groundnut foliar spray TNAU Groundnut rich 2kg / acre / 200 litre,groundnut foliar application,Nutrient Management,JAYAD,AGRICULTURE,TAMILNADU
1368,PUDUCHATRAM                                       ,Others,2017-05-25 18:09:31.793,Others,NAMAKKAL,recommended for drench with carbendazim 2 gm / litre of water,Asked about root rot management in casurina,	Plant Protection	,JAYAD,AGRICULTURE,TAMILNADU
1369,ELACIPALAYAM                                      ,Others,2017-05-25 20:51:32.087,Others,NAMAKKAL,Recommended for today have light rain,Asking about weather detail for namakkal dist,Weather,JAYAD,AGRICULTURE,TAMILNADU
1370,ELACIPALAYAM                                      ,Others,2017-05-26 10:45:24.350,Others,NAMAKKAL,Recommended for Namakkal today weather Report : moderate Rain fall (7.6 – 35.5 mm),Namakkal today weather Report,Weather,JAYAD,AGRICULTURE,TAMILNADU
1371,PUDUCHATRAM                                       ,Vegetables,2017-05-26 10:54:31.800,Lab Lab,NAMAKKAL,recommended for spray Planofix - 4 ml/ 10 lit of water,asking about lablab nutrient management,Nutrient Management,JAYAD,HORTICULTURE,TAMILNADU
1372,PUDUCHATRAM                                       ,Vegetables,2017-05-26 10:56:35.290,Lab Lab,NAMAKKAL,recommended for spray vegetable mixture - 5 gm/ liter of water,asking about lab lab nutrient management,Nutrient Management,JAYAD,HORTICULTURE,TAMILNADU
1373,NAMAGIRIPET                                       ,Others,2017-05-26 11:04:57.383,Others,NAMAKKAL,Recommended for weather report namakkal district have light rain fall,Asking about weather report for Namakkal district,Weather,JAYAD,AGRICULTURE,TAMILNADU
1374,NAMAKKAL                                          ,Others,2017-05-26 15:37:17.867,Others,NAMAKKAL,Recommended for Namakkal district today weather Report : very Light Rain fall (0.1 – 2.4 mm),asking about Namakkal district today weather Report,Weather,JAYAD,AGRICULTURE,TAMILNADU
1375,ERUMAPATTY                                        ,Inland,2017-05-26 16:33:41.050,Fresh Water,NAMAKKAL,Recommended for contact number 0424-2271912.,Asking about erode ADA office,Fish Fingerling Production,JAYAD,FISHERIES,TAMILNADU
1376,ERUMAPATTY                                        ,Millets,2017-05-26 17:00:39.143,Sorghum (Jowar/Great Millet),NAMAKKAL,"recommended for contact to Regional Research Station,
Paiyur(Via), Kaveripattinam-635112, Krishnagiri",asking about seed availability of fodder sorghum,Seeds,JAYAD,AGRICULTURE,TAMILNADU
1377,NAMAKKAL                                          ,Plantation Crops,2017-05-26 17:04:35.073,Coconut,NAMAKKAL,recommended for the copra price : Rs  7000-7800/quintal,Asking about copra  market price,Market Information,JAYAD,HORTICULTURE,TAMILNADU
1378,NAMAGIRIPET                                       ,Others,2017-05-26 17:08:17.103,Others,NAMAKKAL,recommended for today and tommarrow cloudy weather and possibility of less rainfall,Asked about weather report information,Weather,JAYAD,AGRICULTURE,TAMILNADU
1379,TIRUCHENGODU                                      ,Oilseeds,2017-05-26 18:37:33.740,"Castor (Rehri, Rendi, Arandi) ",NAMAKKAL,"Recommended for castor sowing season : june - july, Variety : TMV 5, TMV 6, Hybrid : TMVCH 1, YRCH 1 and spacing : variety : 90 cm x 90 cm, Hybrids : 150 cm x 120 cm","asking about castor sowing season, variety and spacing details",Sowing Time and Weather,JAYAD,AGRICULTURE,TAMILNADU
1380,KOLLI HILLS                                       ,Fruits,2017-05-26 19:50:46.207,Citrus,NAMAKKAL,Recommended Bordeaus mixture preparation : copper sulphate 200gm / 1 litter + calcium carbonate 200gm / 1 litter of water separately. The copper sulphate solution should be added to the lime solution constantly stirring the mixture,asking about Bordeaux paste preparation information,	Plant Protection	,JAYAD,HORTICULTURE,TAMILNADU
1381,NAMAKKAL                                          ,Others,2017-05-26 19:50:47.860,Others,NAMAKKAL,Recommended for today have light rainfall.,Asking about Weather report for Namakkal,Weather,JAYAD,AGRICULTURE,TAMILNADU
1382,NAMAKKAL                                          ,Others,2017-05-26 20:00:37.717,Others,NAMAKKAL,Recommended for weather report of Namakkal have a very light rainfall (0.1 – 2.4 mm)today with cloudy weather,asking about  weather report of Namakkal,Weather,JAYAD,AGRICULTURE,TAMILNADU
1383,ERUMAPATTY                                        ,Others,2017-05-27 06:25:44.700,Others,NAMAKKAL,recommended for the contact number : 04282-221901,Asking about yethapur research station  contact number,Government Schemes,JAYAD,AGRICULTURE,TAMILNADU
1384,TIRUCHENGODU                                      ,Others,2017-05-27 06:59:12.933,Others,NAMAKKAL,"Recommended for Tapioca & Castor Research Station, Yethapur, salem District contact no. : 04282 – 293526","asking about Tapioca & Castor Research Station, Yethapur, salem District contact no.",Seeds,JAYAD,AGRICULTURE,TAMILNADU
1385,PUDUCHATRAM                                       ,Vegetables,2017-05-27 08:30:44.760,Lab Lab,NAMAKKAL,Recommended for spray Planofix 3 ml / 10 lit of water,Asking about Lab lab  flower dropping control .,Nutrient Management,JAYAD,HORTICULTURE,TAMILNADU
1386,TIRUCHENGODU                                      ,Others,2017-05-27 08:57:35.690,Others,NAMAKKAL,Recommended for Namakkal today weather Report : moderate Rain fall (7.6 – 35.5 mm),asking about Namakkal weather Report,Weather,JAYAD,AGRICULTURE,TAMILNADU
1387,KOLLI HILLS                                       ,Others,2017-05-27 09:39:02.773,Others,NAMAKKAL,recommended for the weather report  : today have rain,Asking about weather report for Namakkal,Weather,JAYAD,AGRICULTURE,TAMILNADU
1388,TIRUCHENGODU                                      ,Plantation Crops,2017-05-27 09:41:22.010,Teak,NAMAKKAL,,Asking about casurina wilt management,	Plant Protection	,JAYAD,HORTICULTURE,TAMILNADU
1389,TIRUCHENGODU                                      ,Plantation Crops,2017-05-27 09:41:24.637,Teak,NAMAKKAL,Recommended for spot drenching with Pseudomonas 10 g / lit of water at 15 day interval,Asking about casurina wilt management,	Plant Protection	,JAYAD,HORTICULTURE,TAMILNADU
1390,KOLLI HILLS                                       ,Flowers,2017-05-27 11:07:00.167,Jasmine,NAMAKKAL,recommended for the spray  :Thyochloprid 1 ml /lit of water,Asking about jasmine budworm management,	Plant Protection	,JAYAD,HORTICULTURE,TAMILNADU
1391,PARAMATHY                                         ,Oilseeds,2017-05-27 12:44:43.280,Groundnut (pea nut/mung phalli),NAMAKKAL,Recommended for groundnut foliar spray TNAU Groundnut rich 2kg / ac / 200 lit,groundnut foliar application,Fertilizer Use and Availability,JAYAD,AGRICULTURE,TAMILNADU
1392,KOLLI HILLS                                       ,Cereals,2017-05-27 13:45:16.937,Paddy (Dhan),NAMAKKAL,Recommended for apply urea 25 kg + potash 15 kg + neem cake 5 kg / ac,paddy top dressing fertilizer management,Fertilizer Use and Availability,JAYAD,AGRICULTURE,TAMILNADU
1393,ERUMAPATTY                                        ,Condiments and Spices,2017-05-27 17:10:10.740,Turmeric,NAMAKKAL,"recommended for market price of turmeric in namakkal is rs.bulb-5999-6732,finger-6499-7872/quintal",asking about market price of turmeric in namakkal,Market Information,JAYAD,HORTICULTURE,TAMILNADU
1394,KABILAMALAI                                       ,Plantation Crops,2017-05-27 19:46:17.990,Coconut,NAMAKKAL,"recommended for Mix 50 g of Azospirillum, 50 g of Phosphobacteria  ( or ) 100 g Azophos and  50 g of VAM in sufficient quantity of compost or FYM and apply near feeding roots once in 6 months / palm starting from planting",asking about Bio-fertilizer recommendation for coconut,Fertilizer Use and Availability,JAYAD,HORTICULTURE,TAMILNADU
1395,PARAMATHY                                         ,Vegetables,2017-05-28 06:35:56.987,Chillies,NAMAKKAL,Recommended for spray fibronil 1.5 ml / 1 lit of water,Asking about thrips management in chilli,	Plant Protection	,JAYAD,HORTICULTURE,TAMILNADU
1396,MOHANUR                                           ,Cereals,2017-05-28 10:22:26.440,Paddy (Dhan),NAMAKKAL,recommended for phone number:0422-2474967,asking about Department of Rice phone number,Seeds,JAYAD,AGRICULTURE,TAMILNADU
1397,MALLASAMUDRAM                                     ,Plantation Crops,2017-05-28 10:36:35.450,Coconut,NAMAKKAL,recommended for coconut copra market information 8535- 8625 / quintal,Asked about coconut copra market information,Nutrient Management,JAYAD,HORTICULTURE,TAMILNADU
1398,SENDAMANGALAM                                     ,Others,2017-05-28 11:21:31.847,Others,NAMAKKAL,"Recommended to contact public relation ICAR , 911125843301",Asking about public relation ICAR contact number,Government Schemes,JAYAD,AGRICULTURE,TAMILNADU
1399,VENNANDUR                                         ,Others,2017-05-28 13:40:08.977,Others,NAMAKKAL,"recommended for contact to Soil and Water Testing Laboratory
 namakkal 4286266345",Asked about namakkal soil water testing lab contact information,Soil Testing,JAYAD,AGRICULTURE,TAMILNADU
1400,VENNANDUR                                         ,Others,2017-05-28 13:41:19.470,Others,NAMAKKAL,recommended for today and tommarrow cloudy weather and possibility of less rainfall,Asked about namakkal weather report information,Weather,JAYAD,AGRICULTURE,TAMILNADU
1401,ERUMAPATTY                                        ,Others,2017-05-28 14:20:45.543,Others,NAMAKKAL,Recommended for namakkal  today weather Report : very Light Rain fall (0.1 – 2.4 mm),Asking about namakkal weather Report,Weather,JAYAD,AGRICULTURE,TAMILNADU
1402,TIRUCHENGODU                                      ,Others,2017-05-28 17:17:30.180,Others,NAMAKKAL,recommended for today have a light rain day,asking about tiruchengodu weather report,Weather,JAYAD,AGRICULTURE,TAMILNADU
1403,NAMAGIRIPET                                       ,Others,2017-05-28 17:58:22.630,Others,NAMAKKAL,recommended for today and tommarrow cloudy weather and possibility of less rainfall,Asked about weather report information,Weather,JAYAD,AGRICULTURE,TAMILNADU
1404,RASIPURAM                                         ,Others,2017-05-28 19:39:41.583,Others,NAMAKKAL,recommended for today and tommarrow cloudy weather and no possibility of rainfall,Asked about weather report information,Weather,JAYAD,AGRICULTURE,TAMILNADU
1405,RASIPURAM                                         ,Others,2017-05-28 19:39:57.413,Others,NAMAKKAL,recommended for today and tommarrow cloudy weather and no possibility of rainfall,Asked about weather report information,Weather,JAYAD,AGRICULTURE,TAMILNADU
1406,NAMAGIRIPET                                       ,Others,2017-05-28 19:43:55.400,Others,NAMAKKAL,Recommended for weather report of Namakkal have a very light rainfall (0.1 – 2.4 mm)today with cloudy weather,asking about weather report of Namakkal,Weather,JAYAD,AGRICULTURE,TAMILNADU
1407,SENDAMANGALAM                                     ,Fiber Crops,2017-05-29 10:57:10.483,Cotton (Kapas),NAMAKKAL,"Recommended for cotton sowing season : August - September and variety : MCU 5, Suvin, TCHB 213, MCU 12, MCU 13, Surabhi.",asking about cotton sowing season and variety,Varieties,JAYAD,AGRICULTURE,TAMILNADU
1408,NAMAKKAL                                          ,Vegetables,2017-05-29 11:33:36.650,Onion,NAMAKKAL,recommended for onion market rate Rs. 110/kg,asking about onion market rate,Market Information,JAYAD,HORTICULTURE,TAMILNADU
1409,TIRUCHENGODU                                      ,Others,2017-05-29 11:36:59.350,Others,NAMAKKAL,recommended for having light rain today,asking about Namakkal district rainfall information,Weather,JAYAD,AGRICULTURE,TAMILNADU
1410,ERUMAPATTY                                        ,Others,2017-05-29 11:52:19.953,Others,NAMAKKAL,recommended for today not have a rain day,asking about namakkal weather report,Weather,JAYAD,AGRICULTURE,TAMILNADU
1411,ELACIPALAYAM                                      ,Oilseeds,2017-05-29 15:48:39.487,Groundnut (pea nut/mung phalli),NAMAKKAL,"recommended for phone number:0422-2450812,04288-231242",asking about groundnut seeds availability,Seeds,JAYAD,AGRICULTURE,TAMILNADU
1412,TIRUCHENGODU                                      ,Flowers,2017-05-29 16:21:10.767,Jasmine,NAMAKKAL,"Recommended for contact to Krishi Vigyan Kendra,Veterinary College & RI Campus, S.Karadu(post), Namakkal – 637 001.phone;04286 – 266345",Asking about Namakkal KVK contact address,	Plant Protection	,JAYAD,HORTICULTURE,TAMILNADU
1413,VENNANDUR                                         ,Condiments and Spices,2017-05-29 17:22:12.357,Turmeric,NAMAKKAL,Recommended for apply urea 21 kg + supper phosphate 150 kg + potash 12 kg /acre,Asking about Basal fertilizer management for turmeric,Fertilizer Use and Availability,JAYAD,HORTICULTURE,TAMILNADU
1414,VENNANDUR                                         ,Condiments and Spices,2017-05-29 17:24:30.153,Turmeric,NAMAKKAL,Recommended for dipping rhizome in copper oxy chloride 3 gram /litre of water solution for 30 mints before sowing .,Asking about rhizome treatment for turmeric,Cultural Practices,JAYAD,HORTICULTURE,TAMILNADU
1415,ELACIPALAYAM                                      ,Others,2017-05-29 17:31:33.260,Others,NAMAKKAL,recommended for today and tommarrow cloudy weather and possibility of less rainfall,Asked about weather report information,Weather,JAYAD,AGRICULTURE,TAMILNADU
1416,PUDUCHATRAM                                       ,Flowers,2017-05-29 19:37:07.247,Jasmine,NAMAKKAL,recommended for giberrallic acid 2 ml / litre of water,Asked about jasmine increase flowering,Nutrient Management,RABI,HORTICULTURE,TAMILNADU
1417,MOHANUR                                           ,Oilseeds,2017-05-29 20:07:59.263,Groundnut (pea nut/mung phalli),NAMAKKAL,recommended for contact 04286 275472,asking about Nammakkal district agricultural engineering department contact number,Varieties,JAYAD,AGRICULTURE,TAMILNADU
1418,MOHANUR                                           ,Others,2017-05-29 20:26:58.510,Others,NAMAKKAL,Recommended for Namakkal district Today No Rain Fall (0.0 mm),asking about Namakkal district today weather Report,Weather,JAYAD,AGRICULTURE,TAMILNADU
1419,NAMAGIRIPET                                       ,Others,2017-05-29 21:26:33.950,Others,NAMAKKAL,Recommended for Namakkal district Today No Rain Fall (0.0 mm),asking about Namakkal district today weather Report,Weather,JAYAD,AGRICULTURE,TAMILNADU
1420,ERUMAPATTY                                        ,Flowers,2017-05-30 07:07:13.700,Jasmine,NAMAKKAL,recommended for spay Carbendazim 2g/ 1 litre of water,asking about leaf blight management of Jasmine,	Plant Protection	,JAYAD,HORTICULTURE,TAMILNADU
1421,TIRUCHENGODU                                      ,Others,2017-05-30 08:23:59.160,Others,NAMAKKAL,recommended for the contact number : 0427-2451382,salem horticulture office contact number,Government Schemes,JAYAD,AGRICULTURE,TAMILNADU
1422,RASIPURAM                                         ,Condiments and Spices,2017-05-30 09:57:22.490,Turmeric,NAMAKKAL,Recommended for apply urea 21 kg + supper phosphate 150 kg + potash 12 kg /acre,Asking about Basal fertilizer management for turmeric,Fertilizer Use and Availability,JAYAD,HORTICULTURE,TAMILNADU
1423,ERUMAPATTY                                        ,Others,2017-05-30 11:59:41.617,Others,NAMAKKAL,Recommended for today have no rain,Asking about weather detail for Namakkal dist,Weather,JAYAD,AGRICULTURE,TAMILNADU
1424,NAMAGIRIPET                                       ,Others,2017-05-30 12:47:38.590,Others,NAMAKKAL,"Recommended Forest College and Research Institute in Mettupalayam, Coimbatore contact no. 04254 – 222398",asking about casuarina seedlings availability information,Seeds,JAYAD,AGRICULTURE,TAMILNADU
1425,ERUMAPATTY                                        ,Others,2017-05-30 15:32:04.683,Others,NAMAKKAL,"Recommended to contact Assistant Director of Agriculture , Erumapatty 04286 252225","Asking about Assistant Director of Agriculture , Erumapatty contact number",Agriculture Mechanization,JAYAD,AGRICULTURE,TAMILNADU
1426,ERUMAPATTY                                        ,Others,2017-05-30 15:35:25.867,Others,NAMAKKAL,"Recommended to contact Krishi Vigyan Kendra ,Namakkal",Asking about check dam information,Agriculture Mechanization,JAYAD,AGRICULTURE,TAMILNADU
1427,PARAMATHY                                         ,Vegetables,2017-05-30 15:39:12.480,Onion,NAMAKKAL,"recommended for the fertilizers  :urea  25 kg ,supar phosphate  150 kg ,potash  20 kg /acre",Asking about onion basal fertilizer management,Fertilizer Use and Availability,JAYAD,HORTICULTURE,TAMILNADU
